风险,"感谢您的报价，另外您对本次报价还有什么要补充的可以留言给我，如果货品、价格合适，我会主动联系您。,你好,多大,多少钱一个,一千四的好多斤座右嘛,不会低于20斤塞,OK    我先商量一下   等下给你答复,对了   要得多有优惠没得,OK,贵了,后面有个人给我报价是30斤1200多一斤17块,最近   圈舍还没弄好,重庆    最起码 50个,可以"
正常,老板，什么时候能收到货？
风险,"在吗,批发的吧, 都什么品种,您是负责人吗,想找你们老板谈谈,加下微信吧详细谈谈"
正常,我想进货，可以谈谈
正常,"还有苗吗,价格多少,皮卡车可以装两万吗这种苗,三毛的都像图片那样没有啊"
风险,"你好,现在黄牛600/800斤左右的牛多少钱一斤,活的,你们是自己的农场吗,育肥的,散养的呢？,你的微信是多少？我加你微信好不好？"
正常,怎么批发，包邮吗？
风险," 你好,是的,嗯,你的牛杂可以直接食用吗,贵州省榕江县,能不能发一点我看看,我是卖带皮牛肉粉的，我的粉里面含牛肉，牛皮，牛杂,必须买混合的吗,价格都一样吗,四合一是哪四样，五合一是哪五样,可以加微信到时视频聊一下吗？,18188,147113"
正常,"你好,质量保证吗,有图片吗,好的"
正常,老板，我想跟你确认一下产品特征，有最近拍的照片和视频吗？
正常,我这是江苏省扬州，您那有车送货吗
正常,"怎样交款,还不保运费吗,价格高点,我们这边也没有那么贵，你的价格也没有说有运费，也不知道到果子怎么样,价格便宜点我去付款,要10看看好不，好了就在你家买,你要保证果子的质量，要是口感不好我要退货,45元吗，怎么还是50元"
正常,"你好。一瓶药水多少钱,五瓶以上九十五吗？。意思是一瓶九十五吗,运费怎么算？售后有保障吗？,五瓶以上九十五吗？。意思是一瓶九十五吗"
正常,"欢迎光临本店，量大价格从优，支持惠农网在线交易，看到您的留言我将马上回复，您也可以选择来电咨询哦！,您好,100个起批，50一包,你好:blush:,多少起批,批发价多少钱"
风险,"在吗？,185
1506
0219,v信"
风险,"老板你好,量大有优惠吗，能优惠多少,你要是同意加꯭T꯭g꯭g꯭g꯭4꯭5꯭3꯭吧，平时很少看这个上面的信息,ǫ??"
正常,早上好
风险,"有活的桉树吗,直径5公分的,多少钱一颗,连挖上车,说你电话,是的,我分几批拉,第一次350,第二次500,5公分都可以"
正常,"包邮吗？,这个品种怎么样？,还有别的品种吗？,现在种可以吗？,早吧,你上面的所有品种我各要一个，能不能便宜点,十颗啊,包活吗,当年挂果？,我怎么给你转钱,能不能给我在赠颗别的果苗,冬桃是冬天结果吗？,那你给我赠颗冬桃吧？,已支付了,如果好，我大面积栽种，你那提供技术吗？,好的,你加我微信吧，方便以后联系"
正常,"您好,是的,是的,谢谢您啦,这是三年挂果的树苗对吧,已经嫁接了的树苗？,当年能够挂果吗？,往后产量高吗？,发过来树干多高？,我看打捆的树苗像是二年左右的树吧？,好，谢谢您[可爱],咨询您一下，行距大概多远？,好的,我大概先要20颗试试,直接下单，明天能发货吗？,能不能给我挑点儿大的,我们后续需要的比较多,先发过来看看,好的:ok_hand:，我去下单,老板,名字少个字,苏勇华,请挑选点大棵的，我们果园挑选品种，如果可以的话会大量追加订单"
正常,"鸭苗怎么卖呢？,您这个要多少起拿呢？,湖南永州的,多少钱一只呢？,母鸭吗？,可以分批发吗？还是需要一批1000只这样,那就是一次要1000这样才发货?,因为刚开始养所以可能一次说那么多有点消化不完,可能场地没有那么大,所以可以的话想先可以分批后面做好了一次1000没问题,我们是打算先拿200半个月到20天再拿一些这样,您那边都不包邮，200发跟500发没有多大区别,这个还得看我们这边市场,是的,给家里老人养的,我们这边人比较稀少，年轻人都外出了,您的是多少?,好的"
正常,"你好,这个中小田螺有现货吗？,这个是送货上门吗,我是钦州市灵山县的,好吧"
正常,40一袋是什么标准的？
正常,"你好！,云胖6号适合云南建水这边种植吗？,一般情况下它的净穗有多重？,能把包装后面高清图给我看看吗？,这种玉米不知道抗不抗病和倒伏？,我看资料，你是在昆明经销,一般亩种几包？,哦！他在什么地方？多少一包,你不是说他帮你经销种子吗？,多少一袋？,建水的经销商？我也可能直接找他,那好！可能我理解错了,我想先试种半亩看看品性如何,我今天才下载客户端的。我以前没做过，先了解一下流程。我己经关注你了,你好！,是新种子吗"
正常,"在吗,我想问一下你们的电话号码方便说一下吗？,没关系！,谢谢您！"
正常,"包邮吗？购买后多久发货？,老板，你发货地在哪？"
正常,"您好在吗,我想买点脐橙苗，纽荷尔,现在可以发货吗,怎么卖的,一年以上的！,大概500左右,包邮吗,品种正宗吗,可以上门看看吗,我上饶的,您是赣州哪里,我加您"
风险,"电话行吗？,好的,你那里有孵化小鸡的鸡蛋吗？,你们公司在哪里  "
正常,"多少一斤,一只鸡大概多少斤,嗯嗯,批发包邮吗,我们太远了云南边境"
正常,"这个是什么时候熟,九月中旬是阳历还是农历,好的,行"
正常,"老板，包邮吗？,2000斤,哦哦哦好，谢谢"
风险,"老板你好,量大有优惠吗，能优惠多少,你要是同意加tggg453吧,谢谢"
正常,"我看了起批数量大了点,我找10箱而已,[汗]"
正常,"包邮吗？购买后多久发货？,包邮吗？购买后多久发货？,紫玉兰发实物图片看看,这今年能开花了？,图片上的多少钱一颗的,都是没有叶子,哦，这样,最少买几颗吖,年数越多就越高？,花也越多？"
正常,"你好,突尼斯软籽石榴苗，嫁接苗，有直经多粗的,多少钱一棵,你是什么地方的,哦,谢谢,我要一百多棵,明白,山东省临清市,到你那多远,的几天来到,你也不知道，直经多粗,那就是一公分多,哦,哦,
我想要，直经三公以上的,不远,是,好的老板,明天给你回信息"
正常,"还有多少,是上面发图片的这些吗,2-3斤20一只吗？,还有没有得少"
正常,"你好,你那里还有沙棘种子吗"
风险,"老板，运费怎么算？,要是我想要你呢,把你邮过来吧,哈哈哈哈,我要喜抽插了,哈哈哈哈,就这么捣鼓的,我棒吧,啦啦啦啦啦啦,啦啦啦啦啦,呸呸呸,快点把你邮过来,别废话,蛋大吗？,要,不小就OK,哈哈哈哈,哈哈哈哈哈,沙雕,[爱心],:stuck_out_tongue_winking_eye:,:kissing_heart:,嘿嘿,哈哈哈,去吧去吧,啊呸,呸,呸,呸,呸呸呸,我不要辣,我不要了,你发货太慢了,呸,太慢了,退货退货,不要了,差评差评,不不不,服务态度差,差评差评,回信息慢，差评差评,售后服务有哪些呢"
正常,"批发么,有多少"
正常,"包邮吗？购买后多久发货？,老板，你发货地在哪？"
正常,老板，量大有优惠吗？
风险,"欢迎光临本店，量大价格从优，支持惠农网在线交易，看到您的留言我将马上回复，您也可以选择来电咨询哦！,你好,不是,纯干的,不做调理货,八成,您要量大吗,斤？,20.30斤？,50斤吧,运费我们不管的,批发价，价格不高,煮完，不知道,运费我明天问问,158,6540,7183,jia'wo,发北京哪里？,好的,一件起发,一件10元，发物流,西南郊自提,五斤一卷，一件10卷。50斤"
风险,然后我这边是基金会的。现在我要采购蔬菜的那个抗疫物资需求量可能大一点儿。湖北可以发吗，要是不可以的话发到河北也可以。方便的话你加vx详谈1718/7453/213
正常,哈喽美女在吗？
正常,"你好，,多少斤起批发"
正常,"你好,运送费是包运吗,我每年要十来吨"
正常,您好，长期供应是否可以提供发票呢？
正常,芦花鸡苗啥价？
正常,"感谢您的报价，另外您对本次报价还有什么要补充的可以留言给我，如果货品、价格合适，我会主动联系您。,你好,有猪苗？,嗯嗯,多少斤的多大了？,什么品种？,抗病怎么样？,我不懂，我第一次养,这个可以留母猪苗吗,种猪,阉割了？,为啥？,不能生？,这个还真不知道,想要白色的,二元母猪下的多吗？,这个二元跟三元是以什么方面定义的？"
风险,"老板,在吗？,现在鹅多大了,老板，方便留个电话,加我,加我"
正常,"原材料产地是哪里的？,量大有优惠吗？"
正常,"你好,我想问下发货时间是什么时候以及发货方式"
正常,"在,批发到石家庄多少钱"
风险,"你好,这款机械好用吗？,有没有危险性,就是危险性大不,这样，我在开车你加我一个微信，语音和你详谈好吧,180581,96162  ,懂,我现在不方便，,麻烦你了,你这个人，说话怎么骂人"
正常,"你好,想买点花生种子"
正常,快递吗？
正常,您好，京东物流，是否有发货需求可与我联系
风险,"你好,重楼苗多少钱一颗,你微信多少,地址是哪里,我加你了"
正常,多少钱一板
正常,"您好！,我想选三棵颜色不同的,那有可能是同样的颜色吧,小苗有多高？,当年能开花吗？,好，谢谢！,现在下单什么时候发货？,北京,好，谢谢啦！"
正常,"老板，你发货地在哪？,亲：我要今年的货哦！"
正常,"你的电话发过来,青岛,一天一挂车,批发"
正常,"雷木804多少钱,甘肃省买多少钱,前轮胎多大，后轮胎多大,前轮胎能换小的吗,是19款的，国三,前轮大，机头轻。,物流到甘肃省庆阳市环县曲子镇费运多少,明天发个平花轮胎804图片，及视频。,好,量大有优惠吗？,运费怎么算？售后有保障吗？"
正常,"老板，运费怎么算？,从您那到武汉与北京分别是多少?,例如30斤,外地是快递吗？,好的,好的 有需要联系您！"
正常,你好，我们是杭州自家茶园，具体可以细聊，期待长期合作
风险,"老板你好,找您订些货，湖北可以发吗,可以的话薇꯭T꯭G꯭G꯭G꯭4꯭5꯭3我们具体谈下,谢谢"
正常,谢谢
正常,什么酒，10块钱
正常,最少要买多少盆发货
风险,"您好，在吗,能给个电话，我打电话咨询下吗？,惠农网这个号码打过去没人接,你脱温鸡苗现在有哪些，大概多重一只的？,多少天的？疫苗做齐没有,要不打电话谈，我大概要七八只，就不知道你有那些品种"
风险,"你们那边招代理吗，做代理有什么条件,老板在吗,方便的话加我一下tggg453有时平台没看到"
正常,地膜宽多少米的
正常,"你好,突尼斯软籽石榴苗，嫁接苗，有直经多粗的,多少钱一棵,你是什么地方的,哦,谢谢,我要一百多棵,明白,山东省临清市,到你那多远,的几天来到,你也不知道，直经多粗,那就是一公分多,哦,哦,
我想要，直经三公以上的,不远,是,好的老板,明天给你回信息"
正常,"一代有多少公斤,多少钱一吨"
正常,"最低批发价多少？,要多也是7.5吗"
正常,300一只多重
正常,我想问一下你这个转卖赚钱是什么意思
正常,照样品，我要1吨
风险,"运费还幺算,运费怎么算,运费贵吗？,假如10吨从你那到广西钦州市钦南区要多少运费呀？,微号"
正常,"老板，运费怎么算？,从您那到武汉与北京分别是多少?,例如30斤,外地是快递吗？,好的,好的 有需要联系您！"
风险,"老板在吗,有双赢个生意打你谈下,以免平台没看到消息，请加下tggg453好联系"
正常,你的拖拉机会带旋耕机和犁吗
正常,"老板个在,方便留个电话"
正常,那个地方的
正常,多钱一斤
正常,"能发货吗,好,好的,什么快递,嗯"
风险,"有双赢个生意打你谈下,以免平台没看到消息，请加下tggg453好联系,我想一定会有个愉快的合作"
正常,"水果可以便宜点吗。我想在我们市配送。,和超市价钱差不多"
正常,"你好,在吗"
正常,"老板，运费怎么算？,长沙"
正常,"价格还可以便宜点吗？,我搞批发的"
风险,"在吗,加v聊可以吗"
正常,沃柑什么价
正常,谢谢，我已经联系好了
正常,你好，现在下单什么时候发货
正常,"你好,这个香水菠萝可以一件代发吗,是做电商的,价格呢"
正常,有80厘米宽的吗？每卷多重，厚度是多少
正常,快递是免费的吗？
正常,"多少公分一条,那么短"
风险,"老板在吗,方便的话加我一下tggg453有时平台没看到,我想一定会有个愉快的合作"
正常,"谢谢，我先看看，不知道要种啥,刚下载的软件，我先看看爱,好的"
正常,没有有快递信息
风险,"玉米怎么卖,袋粮,整棒还是粒的,玉米,是的,五吨左右,拉到广东信宜市,你那有现货吗,运费是到付吗,运到我们这要多少运费,帮我问一下,不能线上交易吗,183,2065,1485,先问运费价格吧"
风险,"你好,看到你在求购鸡蛋对吗？,要多大量,可以给你3.1一斤  不包邮,明天发给你 今天发不了了 都在休息,主要买什么蛋？,行,要货稳定就可以   长期有货,价格都好说,好的,重庆九龙坡区西彭镇玉凤村7社,130023,27837,可以加微信联系,好的  要来之前说一声就行了"
正常,你们龙虾 10块一斤？？
风险,"亲，在吗？,现在发不发货,是这样，我要的数量很大，方便+微说么？"
正常,可以走线上交易吗？
风险,"在吗？,找您订些货，湖北可以发吗,可以的话薇Tggg453我们具体谈下"
正常,"鸡苗,一斤左右的,绿壳蛋鸡,半斤左右的呢？"
正常,"晚上好，,请问一下，重你们那里进苗，能全年指导一下不，我是一个新手"
风险,"可以批发吗,黑龙江,您是负责人吗,哈尔滨,你加我吧 ,我们详谈,188,4108,2009,加了告诉我一声我通过一下,加了吗,[可爱][可爱],好的 我通过一下,青岛亚瑟夫？,我听不太清楚你名称告诉我一下,包邮吗？购买后多久发货？,好的"
正常,"你好，这个苗是矮化过的吗,没有矮化的苗吗,就是众诚一号双矮吗,50颗,好吧"
正常,"在吗？,需要大量山茶籽,138,6915,2596,这个是我电话,电话"
正常,"最低批发价多少？,老板，运费怎么算？,隆回"
正常,"你好，在吗？,你们这个安吨数的话，是多少钱一斤。,你好，在吗？"
正常,"最低批发价多少？,可以挑4之5斤的行不,运费怎么算"
风险,"广东,你想买什么,我也不清楚,行吧,加了，同意,电话空号？,我这边需要采购5台柴油设备,老板方便吗？,是这样老板，我想采购5台柴油设备，您方便加我一下吗？,我河北的,我微,171397,41268,在,您是哪里的，,要多少那，什么款式,不太方便的亲,平台下单的，亲,唉，王旭迪是吧,亲同意一下好吧,你好，亲,有什么可以帮您,可以啊,方便的话拍些照片给我看下,可以,加了,不好意思亲，我们这边不方便的,130239,23666,你加我吧,不会是骗子吧,通过一下吧,[可怜],？,老板，可以加我一下,18788/82"
正常,"在,我想大量的要价格能谈吗？,我想去拉一车,在我们这边批发,一车大概5000斤吧,对,我河北,的,是吗？,比这样买也便宜不了多少呀,奥！"
正常,"您好！请问下土鸡批发价是多少，,运到宾阳这样需要多少邮费？"
正常,暂时不需要
风险,"在吗？,可以的话薇tggg453我们具体谈下,谢谢"
正常,你好，现在下单什么时候发货
正常,最低批发价多少？
正常,"明天能发货吗,这个多大,一箱几斤,价格能不能优惠,长期合作,我的先拿一箱看看质量呀,卖价一般多少钱,零售,这两个哪个直接好，皮薄肉厚,个头大,49.9,5斤？,卖多少钱,长期合作价格能不能优惠一点,嗯，我这边也是做市场，如果质量好，价格合适，以后长期合作呀,能开发票吗,嗯,这个和之前的有什么区别"
正常,火龙果1.28一斤吗
正常,你好，买多还能再优惠点吗？
正常,"欢迎光临本店，量大价格从优，支持惠农网在线交易，看到您的留言我将马上回复，您也可以选择来电咨询哦！,量多可以包邮的,您需要多少？,第一次交易，两个我可以包邮,两个以上。果实包您满意的,您好,怎么退款了呢？,您放心，不会发次货给您的,您看一下，需要我发货还是，退款呢？没事的,一个平均35斤左右,我都是现摘的，我可以摘的时候，发视频给您,是的,不好意思，白天活累了，睡着了,[大笑][大笑][大笑],那我给您发货今天,好的，您放心。[握手][握手][握手],好的，今天我就安排给您发货。摘果视频，我也会给您发过去,"
正常,"老板，运费怎么算？,长沙"
正常,"你好,不知道适合不,四川乐山,气候土壤口感"
正常,"你好，你好！,你那里是不是有桂苗卖呀？,你那里是哪里呀？,多少钱一条？,大概有多高。,多少年的苗？"
正常,"沉香小苗多少钱一棵？,20000,电白,太贵,价钱相差太远，无法谈"
正常,"一件多重,包运费是吧？"
风险,电话是多少？
正常,欢迎光临本店，量大价格从优，支持惠农网在线交易，看到您的留言我将马上回复，您也可以选择来电咨询哦！
正常,"在不,有芦花鸡苗卖吗多少钱一只啊,最低批发价多少？,发你的电话给我可以不"
正常,"在吗？,你这边有买猪苗吗？"
正常,9.9元一箱橙子有几斤 包邮吗
正常,为啥发货这么晚？
正常,"你好，老板这是麦鱼水不啊,老板1000条50元对吧，多长一条啊"
风险,"有下捡苹果图片吗,想合作就加我微信78841607,我是西安的，怎么联系？,如果可以我开车过去,高检是什么样子？,才学做生意不懂，还请多指教,可以！我是在农村出售,口感好。价格便宜就,咱们怎么交易？,数字是什么？,高检价位是多少？,发位置给我,行,你电话给我,好的,一米八宽，两米四长，的车能拉多少？,苹果是散装还是袋装？,能装袋吗？,路远，散装拉不了多少啊,可以,我记了你电话,明天去联系"
正常,有现货吧
风险,能加微信吗？手机号就是微信号
正常,"你好，多少钱一斤,宰杀吗,你那边出售活牛多少钱一斤,送货吗"
风险,"二百来斤公牛怎么卖,你好,土杂,土黄牛吗,大小都这你吗,你是牛经纪吧,156＊＊＊＊0501,9785"
正常,"欢迎光临本店，量大价格从优，支持惠农网在线交易，看到您的留言我将马上回复，您也可以选择来电咨询哦！,您好！"
正常,"什么时候能发货,什么快递"
正常,"你好，这个买完就发货吗,OK[大笑]"
正常,现在能发货吗
正常,"今天羊角蜜发多少钱,通货便宜吗,多少斤起批,哦  我拉不了这么多"
正常,40的最低多少钱
正常,您好，必须1000斤起拍吗
风险,"你好,微,信,多少？,可否加个微信？"
正常,您好，必须1000斤起拍吗
风险,"在吗？,找您订些货，湖北可以发吗,可谢谢以的话薇tggg453我们具体谈下"
正常,"货到付款可以吗,定金多少,四川"
正常,我这里有紫色的见血清，直不直钱呢
正常,"你好,我想咨询下羊肚菌,yangyangyangdamai"
风险,"你好，架子牛怎么卖？,西门塔的,加个微信"
正常,"做生蚝排的规格,你们有吗"
正常,"你们家的玉米粒怎样,本省包邮吗？,我们家买来养殖猪的,每个月6000斤以上"
正常,"少一点可以拿吗？,我是饭堂吃的,一包有什么斤呀？,可以买一包吗？,太多了"
风险,"在吗,是的,是产地直发吗,加个v方便沟通，"
正常,"你好,现在湖北可以发苗吗？,自己庭院栽的一样要几棵可以吗？,冬桃行不,我一样要几棵不知道我这里气候怎样,好的,我看看"
正常,"陈师:一箱多少斤,好的，发我这个是5斤还是10斤,多大的果"
风险,"你好，包邮麽？,五百斤左右，后续还要,拉不了，要你发,大果,微信同号麽？"
正常,"老板，运费怎么算？,江西宜春宜丰"
正常,"雷木804多少钱,甘肃省买多少钱,前轮胎多大，后轮胎多大,前轮胎能换小的吗,是19款的，国三,前轮大，机头轻。,物流到甘肃省庆阳市环县曲子镇费运多少,明天发个平花轮胎804图片，及视频。,好,量大有优惠吗？,运费怎么算？售后有保障吗？"
风险,"老板你好,找您订些货，湖北可以发吗,﻿如可以请加tggg453满意我立马平台订货,谢谢"
正常,"老板[可爱],老板，广州几天能到,货发好点的，我做样品用,还有，你那有视频的素材吗,快递只发中通吗,芒果"
正常,"您好，咱们上面价格，都是包邮价格吗？,北京，今天下单，明天能到不？,这个，15.99也是包邮么？,也是咱们北京现货，是吗？,都是北京现货是吗？,我是北京这边物业，想给小区业主采购，咱们能固定北京发么"
风险,"老板你好,找您订些货，湖北可以发吗,可以的话薇tggg453我们具体谈下"
正常,你们龙虾 10块一斤？？
风险,"有没有包杀好的,微信吗,鸡是不是放养的,买几个可以寄,深圳"
正常,"包邮吗？购买后多久发货？,这两天货啥子价格,我成都这边批发的,有好多种货？价格大概在多少"
正常,武汉发货么？
正常,"这个价格是自己出运费吗,是走物流吗，如果是物流我得去沛县拉,你那里有豆皮吗，要是有什么价格,你这个豆粕是喂鸡专用的吗,我们这边几家都是用的，亿海的豆粕，前几天我们几家合伙买了二十吨四海的,如果你这个我们养蛋鸡可以用，以后就从你这里买。"
正常,"你好,多少发货"
正常,"你好,在吗,你家批发菜籽油吗"
正常,"曾总安排3800只[可爱],曾老板，帮安排2500,好的"
风险,"老板你好,找可以的话薇tggg453我们具体谈下您订些货，湖北可以发吗,找您订些货，湖北可以发吗"
正常,"老板在不,500斤菜花，运费怎么算的？"
正常,襄阳农村发货吗
正常,"包邮吗？购买后多久发货？,在漳州哪里"
正常,"在吗,能发货吗"
正常,"晓密价格多少,有哪些价格多少"
风险,"感谢您的报价，另外您对本次报价还有什么要补充的可以留言给我，如果货品、价格合适，我会主动联系您。,可以选果吗，75一90,哦,80/90多吗,2.5统果有,微信号"
风险,"你的电话发过来,青岛,一天一挂车,批发"
正常,"在不,我想问一下，你家这个鸡最大有多大,一年左右。,嗯,多少个起发呀？,从哪里发货？,损伤算谁的？,贵州省凯里市施秉县, 我们直接在这商城上交易吧。,嗯,多少钱一个？,价格这么高呀，今年。,嗯嗯"
正常,20斤卖吗
风险,"你好,我想找您批发这个,方便加个wx聊一下嘛"
正常,"您好,您这个如何包装,箱里面怎么装,包泡沫还是,我买了五斤然后没有好好包装 ,就想问一下"
正常,"你好,1斤大概有多少只,大概，有500吗？,1只大摡多重,麻烦方便称一下？我们主要需要500只,是的。,好的，谢谢。"
风险,"老板有没有脱温鸡苗呢？,我加了微信你同意就好了。"
正常,现在可以发货吗
正常,"现在价格多少钱？,便宜的吗？,便宜的有图片吗？"
正常,多少钱一板
正常,多少包邮
正常,"老板看杨树苗吗？107批发,包邮吗？购买后多久发货？"
风险,"您好，在吗,能给个电话，我打电话咨询下吗？,惠农网这个号码打过去没人接,你脱温鸡苗现在有哪些，大概多重一只的？,多少天的？疫苗做齐没有,要不打电话谈，我大概要七八只，就不知道你有那些品种"
正常,是送货还是快递，市区歇台子？
风险," 你好,是的,嗯,你的牛杂可以直接食用吗,贵州省榕江县,能不能发一点我看看,我是卖带皮牛肉粉的，我的粉里面含牛肉，牛皮，牛杂,必须买混合的吗,价格都一样吗,四合一是哪四样，五合一是哪五样,可以加微信到时视频聊一下吗？,18188,147113"
正常,"亲,三年苗的一棵树能接多少,十来棵,四川的适合种植这种吗,结得多不多,一颗大概可以结多少,棵,三年的当年可以挂果吗,价格可以再少点吗,果子大不大,里面的核大不大,包邮吗？购买后多久发货？,包邮吗？购买后多久发货？,怎么改价,？,10棵,刚才你不是说按8块一棵吗[大笑][大笑],[OK]"
正常,"你可以帮忙安排一下货运吗？,一只多重,包邮吗？购买后多久发货？,你们能帮杀吗？,活的啊,我们这不能弄活鸡,  嗯嗯"
正常,"您好,是的,是的,谢谢您啦,这是三年挂果的树苗对吧,已经嫁接了的树苗？,当年能够挂果吗？,往后产量高吗？,发过来树干多高？,我看打捆的树苗像是二年左右的树吧？,好，谢谢您[可爱],咨询您一下，行距大概多远？,好的,我大概先要20颗试试,直接下单，明天能发货吗？,能不能给我挑点儿大的,我们后续需要的比较多,先发过来看看,好的:ok_hand:，我去下单,老板,名字少个字,苏勇华,请挑选点大棵的，我们果园挑选品种，如果可以的话会大量追加订单"
正常,"在吗,拍了,一箱,29,希望果能好吃,明天能发货吗,啥快递,哦我这一箱能有几个,能有几个,一箱"
正常,多少斤起发
正常,"包邮吗？,坏果包赔吗？,什么时候发货？,有实图吗？"
正常,"多大用量,200克的吗,有点贵"
正常,你好！
