正常,"车我自己有,是的,多少钱嘛货源多不多,等病情好了我来拉,好到时候联系你,好的,25到30斤就可以啦,过了病情在联系你吧,现在出不来,25到30级的人890吗？
有点贵。"
正常,"价格还可以便宜点吗？,田总[大笑][大笑][大笑]货发过来了吗"
正常,"你好,有西瓜红红吗？,我是大量采购的,也可以,图片看看,至少500斤"
正常,有淀粉型地瓜种吗
正常,"量大有优惠吗,你有多少量"
正常,你好我要板栗树苗我的电话是这个
正常,"几年苗 多少钱,3年的苗多少钱,3年的苗多大，有图片么,好,五年苗多少钱,花期多长时间,我看有卖300一颗的，品种不一样么,能发些开花图片看看么,双瓣的,双的呢,嗯嗯，好的"
正常,"有种么,合作社种植"
正常,大果一个大概多大
正常,"在吗,想要一万颗桉树苗"
风险,在  联系电话给个
正常,"在吗,不是杯苗吗"
正常,"一件发吗？ 先尝尝看。还有你社区团购9的倍数那个链接，是1斤的尝鲜价？,我自己先拍个9斤尝尝看，打算做下电商和社区群里卖。,你们海南的芒果和广西的口味有什么区别,我看主要还是你们两地方产出。,我浙江的，我们这里不吃酸辣青芒，到时之前旅游时候碰上过你们海南的小伙伴做了个青芒还是硬的加酱油。"
正常,老板你好，杉树苗多高起苗
正常,"你好，我买的是同一品种，会不会存在不是异花授粉导致产量低的问题呢,好的，我先在自家院子种几棵看看，理想的话再扩大种植,你好，我想了解一下，我这个地区的年冷量只有250小时，是不是不适宜种植这个恐龙蛋品种啊"
正常,"真二百一头吗,养大了杀了吃,怎么卖的,啃长不,小猪怎么卖的,想自己养过年猪,二头不送吗,役苗那些都打没有,别养段时间死了,健康着不,怕养死了,你们是哪里的,我们是四川南充,有些远,你那猪要是健康的，到我们这卖一车都有人买,那猪路上死了怎么办,还有它吃啥,万一路上死了会么办,意思我们这边也有你们的人吗, 没上面买过，有点怕,能货到付款不,要是没问题，好多人都会丰买,定金多少啊,我想一下子哈,主要是我没有上面买个"
正常,什么季节适合种西蓝花？
正常,"什么鹅,多少天的,包邮吗？购买后多久发货？,老板，运费怎么算？"
风险,"1,请把电话改成：1817933536"
正常,"你好,泰优什么价格,我自己去拉,是去年晚下半年的吧"
正常,"冬青树苗有几种,在吗,你好,又有个朋友想买点冬青树苗能不能推荐一下,他要五十高的,一百颗,直径多少,好的我问下他,咱们是哪里的"
正常,可以到实地看货吗
正常,"偷图,看看我发的行不,:grinning::grinning::grinning::grinning::grinning:,图片,包邮吗？购买后多久发货？,真费劲"
正常,"在吗,这个种植技术你们能提供吗,这个需要先育苗吗"
风险,"老板在吗,有个生意找你谈下，能不能加微聊，,方便的话加我一下:regional_indicator_symbol_t: :regional_indicator_symbol_g: :regional_indicator_symbol_g: :regional_indicator_symbol_g: 453有时平台没看到,感觉你们都很少看这个上面的信息吧"
正常,"欢迎光临本店，量大价格从优，支持惠农网在线交易，看到您的留言我将马上回复，您也可以选择来电咨询哦！,你好，这是78斤的,七八斤的，,好像还有6斤多的,大哥你要多大的,我看看有没有合适你要的重量,疫情影响，这鸡已经多养了两个月了,村里封路，进出两难,稍等，我给您问一下我老表,他养的，人老实，不会卖，我看的着急，我替他发的,我问下,马上回复你,哥哥,人可能睡觉了,你要多少只,明天我回复你好吗,价格差不多就行,把人都吃的乃不起了,好几千张嘴，光玉米都欠了快是万块钱,是的，公鸡,我舅家养的,要不，我打电话问下,你要"
正常,"去皮萝卜丝什么价格？？,货多？？我要几吨,几吨是什么价格？"
风险,"老板如何联系？需求韭菜心,老板，留个联系方式，我直接过宾阳和你聊"
正常,一次要货多少需要
正常,"在吗,1.5的价格是包运费了吧,苗都是多高,多大的？,果苗直径有烟头大吗？,多少时间的苗？"
正常,"可以了,要下载了才可以看,那我西瓜的看看在一起买,西瓜的就不要了,就  改良太空二号,付款了,好的,在买两包,一起发"
正常,"你好,货批发吗？,我要的是水果不是苗子,我们是北方这个我们这不能种吧,这个平台不是批发水果的吗？,惠农网，还是就批发水果苗子的？,嗯，我批发水果"
正常,到徐州运费多少
风险,"您好，20斤大概多少条，滕州能发吗？包物流吗,老板，运费怎么算？,在吗,想买点黑鱼苗，小鱼塘业余养着玩的，不需要太多,看你设置的最低20斤 买20斤苗应该可以,老板，能发吗,您微信多少 ,你们在微山什么地方,现在没苗是吧，要是不能发 我去你们拿拿可以吧,离珍珠岛不远了吧,去那钓过鱼，两城那片"
风险,"加微,信"
正常,"9斤包邮吗,多少钱,哪种最好,金煌多少钱"
正常,玉米价格0.68
正常,"原材料产地是哪里的？,量大有优惠吗？"
正常,"老板，我想跟你确认一下产品特征，有最近拍的照片和视频吗？,价格还可以便宜点吗？,包邮吗？购买后多久发货？,售后服务有哪些呢？例如运输货损赔偿，一贵就赔等等。"
正常,"你好,一件代发，上架了你家的产品，如果有人下单，我是不是还要联系你发货呢？"
风险,"你电话号码是多少,好的"
正常,"最低批发价多少？,贵了,3000多"
正常,在不老板
正常,"在吗,拍了,一箱,29,希望果能好吃,明天能发货吗,啥快递,哦我这一箱能有几个,能有几个,一箱"
正常,我问运费是不是你方出
风险,"你好,请问你收购鸭子吗,你们潢川应该收购鸭子的挺多的啊,要我我给你推荐一个你问问,潢川那边收鸭子的,qq1025654013,这是微信，你加一下,姓李,收到没,没事，他们是大量收购，价格可能没有零售高,你那多少天了"
正常,"亲你好可以做代理吗,我来做代理帮你卖东西,云南玉溪,哦总共有多少个机型`,每个机型和价格配图我了解了解,好的"
正常,一件多少斤
正常,"可以发货不,三角五有多大一颗"
正常,老板你好
正常,"你好，你们辣椒，咸度咋样，酸吗？中辣还是特辣,是的，但是有中度辣没有，我们准备做剁辣椒蒸鱼，现在湖南人都好多不能吃辣,你们在衡东吧，要是方便有时间去你那看看可以吗？,我是准备做鱼块[可爱],我们现在需要一个好辣椒，现在生意不好做,衡阳，,到时候我过来，你发个地址就好了。[可爱],你电话多少,我是长期需要，量要做，我们准备主打这个,我们在市里有门面，有配送,我姓王，到时候我过来提前和你联系,你们价格是多少"
正常,"西洋参,就看一下,买点来吃,好的，可以先半斤,用完再来，怕多了放久了不好,可以不,我在工厂上班没有冰箱,吃了好，我一定推荐,这个能放多久,好吧,我真怕放久了不好,我又一个人吃,怎么地址上去不行,这样行吗,这样晚上才来,我要去吃饭了,我设置好了就是上不了,这样可以了哈,要发好的以后才好向别人推荐,啥时候收到货呢,好的"
正常,"最低批发价多少？,我再看看吧"
正常,"你那的？,125,45,我到北京运费8块，你觉得到你哪能给多少,117,天津那？,350公里,你是每天要还是两天一回,两个地一天的量多少,你要是两天能拉一车，我给你让到5块,粉白都有，不挑,每筐净重45,标准45,20,你是搞批发的？,你现在在哪拿货？,呵呵，这边贵多了,那就差不多,你看吧，要是两天能拉一车，我就给你准备，三，四天拉一车，不好准备，慢慢天气暖和了更不好弄"
正常,"啥价格，,70，75,水果店,二等果混装200箱能给啥价，"
正常,"欢迎光临本店，量大价格从优，支持惠农网在线交易，看到您的留言我将马上回复，您也可以选择来电咨询哦！,您好！"
正常,嗯怎么卖的
正常,1000棵不发货吗？
正常,"[大笑],多少钱一斤？,有没有干的八角？"
风险,"在吗,嗯嗯,好的,维支付可以吗,:heavy_plus_sign:↓我叭,我,180,580,36875,:heavy_plus_sign:↓叭,哦"
正常,"你好,你有树苗吗？"
正常,"玉米培土可以吗,多少钱,行距50.60能培土不,问题是能培好才行,货到付款可以吗,多少钱,柴油,有区别吗,河北保定, 奥,用在联系你"
正常,"一件代发的也包邮嘛,你好"
正常,"二元仔猪，有多少斤，,你们地址是哪里的，怎么托运过来。"
正常,"亲,三年苗的一棵树能接多少,十来棵,四川的适合种植这种吗,结得多不多,一颗大概可以结多少,棵,三年的当年可以挂果吗,价格可以再少点吗,果子大不大,里面的核大不大,包邮吗？购买后多久发货？,包邮吗？购买后多久发货？,怎么改价,？,10棵,刚才你不是说按8块一棵吗[大笑][大笑],[OK]"
正常,"这个价格是自己出运费吗,是走物流吗，如果是物流我得去沛县拉,你那里有豆皮吗，要是有什么价格,你这个豆粕是喂鸡专用的吗,我们这边几家都是用的，亿海的豆粕，前几天我们几家合伙买了二十吨四海的,如果你这个我们养蛋鸡可以用，以后就从你这里买。"
正常,"您好，请问现在能邮芒果吗？,邮往辽宁,价格还可以便宜点吗？,大概多久能到？,好的，芒果能够保证不坏吗？,您这有椰子吗？,还有百香果您这有那？,把链接发我一下好吗？,包邮吗？购买后多久发货？,运费收多少啊？,只能单个下单是什么意思？,你好？,运费怎么下单？我没弄明白,怎么协商？,现在邮费多少钱啊？,单个下单是什么意思？,辽宁的，不需要额外加运费吗？,包邮吗？购买后多久发货？,大概多久能到来着？,包邮吗？购买后多久发货？,您家有椰子吗？"
正常,"最低批发价多少？,我们是村里准备组织成立合作社，正在考察看看是准备搞种植或者养殖，因为我小时候会去钓黄鳝，所以对黄鳝有兴趣，就想了解黄鳝的养殖条件和技术,广东韶关,田地，鱼塘我们这里没这个条件,这个没确定项目之前暂时还没改造，只是普通农田，但是农田上面就是大山塘，可以根据养殖条件改造的,需要什么样的环境，希望农田都是种植黄烟和水稻的,需要什么样的环境，以往农田都是种植黄烟和水稻的,这个完全可以改造的，农田上面有一个大山塘，引水很便利，一般一亩可以投放多少只苗,黄鳝会钻洞，农田养殖要怎么防止跑掉,水温没测过，"
风险,"最低批发价多少？,老板，运费怎么算？,是,加微信了,最低批发价多少？,老板，运费怎么算？"
风险,"你好批发多少钱,加微信详细谈吧，行了,180,581,961,62,谢谢,加了吗"
正常,"您好,一件几斤"
正常,"你好,烟薯25，小的有货吗"
正常,"你好，买一箱能买吗,你们是快递还是物流,运费大概多少"
正常,"你是自家产的,？？？？"
正常,怎么卖啊？
风险,"你好,看到你在求购鸡蛋对吗？,要多大量,可以给你3.1一斤  不包邮,明天发给你 今天发不了了 都在休息,主要买什么蛋？,行,要货稳定就可以   长期有货,价格都好说,好的,重庆九龙坡区西彭镇玉凤村7社,130023,27837,可以加微信联系,好的  要来之前说一声就行了"
正常,"你好,量大有优惠吗？,河北沧州,你那一车是多少个,咱们关送吗,哦哦运费我们自己出是吗,我要是要的还多你能优惠吗,最低1.45吗,现在长钱了,好吧我考虑考虑我要的量大,嗯好吧我考虑考虑,只是价格贵一点,行,你这价格和我们写一样,嗯我看看吧,主要是在你那拉回来我在跑去运费比我们当地还贵一点,没有1.5多,在你那进的那人应该是自己用吧不是卖"
正常,"最低批发价多少？,老板，运费怎么算？"
正常,"你好,1斤大概有多少只,大概，有500吗？,1只大摡多重,麻烦方便称一下？我们主要需要500只,是的。,好的，谢谢。"
正常,"您好在吗,我想买点脐橙苗，纽荷尔,现在可以发货吗,怎么卖的,一年以上的！,大概500左右,包邮吗,品种正宗吗,可以上门看看吗,我上饶的,您是赣州哪里,我加您"
风险,"玉米怎么卖,袋粮,整棒还是粒的,玉米,是的,五吨左右,拉到广东信宜市,你那有现货吗,运费是到付吗,运到我们这要多少运费,帮我问一下,不能线上交易吗,183,2065,1485,先问运费价格吧"
风险,"卖菊花小苗吗,白扇苗有吗,江苏太仓,我知道可以种的,大概要两万颗,是从哪里发到我这里,加个微信吧方便联系,苗肯定要，现在走货运能发到这边吗"
正常,"怎么发货,最低多钱,最低要多少,发货,运费是谁的？,散装的还是箱装？"
正常,你家的鸡多少钱一只1.7吗？多少起批？包送货吗？
正常,"武汉能发货了吗,【发什么快递】,武汉发货吗？,在吗？"
正常,"老板你那有乐普道吗？,抑霉唑有吗"
正常,"你好，这玉米多少吨可以发,运费多少呢,云南丽江这边,一吨吗"
正常,"你好,你们是那里,我想要10吨土豆,多少钱一吨,我们自己去啦,能少点吗？"
正常,"你好,地头价包邮吗"
正常,"你好,一箱三块多啊,批发价？,一斤有多少个啊"
风险,"在吗,有货吗,我是打算给员工做福利的，方便加下微信吗？我需要大量！"
风险,"你好,你好,刚刚电话给你联系,方便把手机号发一下吗,你们这边的话我要求的量大可以给提供吗,己加"
正常,"你好老板,你好，你们沙糖桔在哪里？具体地址发给我一下好吗"
风险,"在吗,1897547,8278"
正常,"你好,一亩地可以载多少棵,买了300棵先种着看看，今天还买了50棵花椒树，不知道还能留下来多少地亩,瞧瞧吧如果留的地多的话，来年再补充,或者今年再买,在吗,这树是一年的苗吗,需要几年的生长才可以,计算了一下还差700棵,一会回去再下单,怎么找不到哪个连接了,看到订单了吗"
正常,在吗？
正常,嗯
正常,"曾总安排3800只[可爱],曾老板，帮安排2500,好的"
正常,"你好,我们现在想做个活动都是山东半岛的，如果我们需要采购能直接联系您嘛，您的价格不会变吧，货您是有的吧,你们包邮嘛"
正常,50棵卖吗
风险,"感谢您的报价，另外您对本次报价还有什么要补充的可以留言给我，如果货品、价格合适，我会主动联系您。,这软件搞不明白,我想要几棵樱桃树,安徽亳州适合种什么品种 老板推荐一下,嗯嗯,是不是一下要买十棵,嗯嗯,也是啊,好来,加你微信了"
正常,"这是澳洲虾吗？,红虾么？,多少斤可以批发,我要的不多   我只是买几斤看看货   如果可以我大概后期要2000斤,加不了"
正常,"这个是多大马力,什么价格,哦,有二手的么,湖北孝感大悟的,嗯"
正常,品种如何？
正常,"番石榴 我可以专供你 价钱可以再谈,电商也可以."
正常,卖的多能便宜不，包邮不
正常,先买点尝尝看！
风险,"老板:今日鸡价多少,土2,麻鸡多少天？多重？,多少起批？,麻鸡有没有图片看？,一级货？,多少起批？,要定金吗？,要dingjin吗？,多少,500,地址在哪,明天再联系你,肇庆,老板:今日抓小鸡还是大鸡,老板:吾回信息,没有中鸡吗？3斤多的吗,昨晚聊的,你看上边微信，昨晚聊的,鸡行。昨晚6呢,今日抓什么鸡吗,你电话几多,是不是成品鸡"
正常,"你好！,老板:打算想要，但担心品质问题,贵州,我只是先试种一点，效果可以再多进点,杨梅有多大1粒,3年苗多少钱一棵,黑炭的多少钱1棵,包邮价吗？,东魁口味是带酸味吗？,两种的甜味那个深一点,能发邮政不,多少棵可以发,今年种，今年可以挂果吗,成活率包不,能不能先发3棵来看看,我已经付款了，能尽快发货吗？,谢谢老板，选好点的苗，下次会再合作的"
正常,你好，现在可以快递到武汉吗
风险,"你好  我需要一些鱼苗   要的多  希望能给优惠  夹我189047
79937详谈,你好  我不经常在线  加我v详谈,加了吗老板,你加我吧  我加好友上线了,只要好  价格不是问题,加我详聊,加我详聊吧,那有机会合作"
风险,"是的，过几天过去看看货，你微信电话多少，过去给你电话,好的，[可爱]"
正常,苹果多少钱拉
正常,"多大用量,200克的吗,有点贵"
正常,"请问你这是哪里,我看写的是松原,我想买种公羊,1只,我家里养的是寒羊,把你电话方便告诉我吗"
正常,你要山药豆
正常,下午好
正常,还不需要
正常,"你好,龙九通货什么价？,好块，最起码没沟没眼吧,通货,能发些照片看看货吗？你发的这个三毛的是什么质量,大概什么质量什么价？,给帮发货吗？,我山东聊城"
正常,"老乡在不,我武威地"
正常,"在不,你的草乌是什么样的,哦！是炙了的吗,确定咯，要是炙过的怎么办，我在几个平台上都买过，都是炙过的"
风险,"在吗？,需要大量山茶籽,138,6915,2596,这个是我电话,电话"
正常,"运费怎么算？售后有保障吗？,你好 ,包邮吗 请问这个"
正常,老板，我想跟你确认一下产品特征，有最近拍的照片和视频吗？
正常,"在吗,1个,你那有几个规格的,1.0的,加工的"
正常,"您好有什么鸭0,你这里
,白鸭也有吗"
正常,"是新土豆吗？多重以上(如3两以上)？,100吨以上才起批，本人没有那么大的胃口[可爱],300吨以上才起批，本人没有那么大的胃口[可爱],知道了，谢谢！[可爱],100吨起批？本人那有那么大的胃"
正常,你好，现在可以快递到武汉吗
风险,"老板在吗,你们那边招代理吗，做代理有什么条件,方便的话加我一下꯭T꯭G꯭G꯭G꯭4꯭5꯭3有时平台没看到,我想一定会有个愉快的合作"
正常,"弥雾机有货没,多少钱一台,脉冲汽油的,下边的还有优惠不,想要两台，给便宜点,好的，我考虑一下"
正常,"湖北黄冈发货吗,老板，这个成活率怎么样？,两年的什么价,两百棵,有优惠吗,好的谢谢,是有购买嫁接的油茶苗意向,二百棵,可以同时发两个品种的苗木吧,请问两个什么品种的,如何区分开来,还有其他的品种的吗,哦,四号皮厚点,出油率低,比较而宫的,。好的,湖北黄冈这边能发货吗,我十六号你那边的不能过来之后退款了"
正常,看图片猪板油很好，都是找么大片厚实的吗？如果是我想大量收购
正常,"你好，刚刚手机没电了,打我电话"
正常,什么价，有货没有
风险,"你好,咱们这块能一件代发吗？,我们是电商这块的,好的,方便加个微信吧,除了产品，其他大米的报价信息表可以一起发我,OK"
正常,"这是澳洲虾吗？,红虾么？,多少斤可以批发,我要的不多   我只是买几斤看看货   如果可以我大概后期要2000斤,加不了"
正常,水田能做业吗？有座位座在后面吗？
正常,"批发,要狠多,能便宜点不？,杏子，水蜜桃,一米高的,一年苗，两年苗我看看,一年苗多少钱,67,69,杏子水蜜桃,嗯,太贵了,还是太贵,0.9,合作愉快,没那意思"
正常,"在？,我是山东这边电商,贵妃芒"
正常,你好，这鸽子一只重两斤多?
正常,"什么时候发货呢,老板，我想跟你确认一下产品特征，有最近拍的照片和视频吗？,好的，,我买的是桂味,好的,一般什么时候7,发货,包邮吗？购买后多久发货？,好的,老板，幼苗种的时候要施什么肥的,鸡粪要放吗,那就是说种的时候什么也不放,好的,今天能发货了吗,多久需要嫁接,还是不用嫁接,直接种就是了,好吧,没关系,下雨天，理解,老板，我加单,再:heavy_plus_sign:一颗桂味,我申请退款，然后再下单,好的,百香果哪个品种是最香，好吃的,桂味高压苗是不是老树苗,老树苗跟新树苗有什么不一样吗,你给我发高压苗呗,"
正常,"在,你好,买东西,你有喂猪的伺料吗,怎么购买啊,包邮吗？我要的比较多大概两千多,嗯，怎么买,小猪的,什么,嗯，可以"
正常,"可以发点样品看看吗？,买两公斤样品可以包邮吗，上海,链接,不是60一公斤么,错了，不是30一公斤,这30/公斤是什么,请保证质量,2015药典,好谢谢你[拜一拜]"
正常,"发快递吗,上海,10斤"
正常,"你这个是长大二元母猪吗？25公斤多少钱一只,湖南的,长白元种母猪，又要多少钱一只,包邮吗？,你可以发个二元母猪和长白母猪视频吗？"
正常,"价格还可以便宜点吗？,请问这种土狗养大大概有多少斤啊？,我想要20只土狗幼苗来养殖,狗苗好的话大批量要货！,在吗,最低批发价多少？,在吗？"
正常,老板有意向可以深度了解下
正常,老板，你们每个月都固定需要白玉蜗牛吗
正常,"在吗,你这个果粒多大的规格的,多久的库存,大概是去年几月份的呢,那这算是过期的了呐,有现拍的吗,发来我看看成色大概什么样,味道有变吗,能先拿几斤样品看看成色在决定要不要多拿吗,怎么下单,先拿几斤怎么下单,好的,加你了"
风险,"你好,你加我微信说吧,不让发啊,怎么发,哦哦哦,你加我的,V 1568 , 7920095,加了吗,你加了吗,人呢,好的有看下"
正常,老板电话多少多
正常,"亲你好可以做代理吗,我来做代理帮你卖东西,云南玉溪,哦总共有多少个机型`,每个机型和价格配图我了解了解,好的"
正常,"我在采购大米，您有现货吗？价格多少？,你们厂地址在什么地方,手机号码多少"
正常,"在不,要200斤多钱一斤, 0.7元一斤需要一次拿货多少斤,皮皮栆是啥栆,哦,好些的，有没有便宜些的,62斤就可以2.3元一斤"
正常,可以等
正常,"要运费吗,运费多少呢,到重庆,批发呢,几百斤"
正常,"你好在么,你好问下你卖的章鱼须,是生的还是熟的,没有熟的么,有图片吗,这个还不行,我们做饼"
正常,"您需要白木耳吗？,[大笑]"
正常,"你好老板，我想咨询一下，你这产品是需要冷冻储存吗？,要是邮寄到福建莆田大概运费多少,昨天晚上在忙了，
冷冻了，烤着，或者煎，那些需要解冻吗？,等我过段时间整理好了，我先拿个样品试吃一下,好的，保质期有2/3个月对吧,好的，到时我找你们拿些货跑烧烤,嗯嗯，我到时找个熟人的烧烤店先做做看,嗯嗯！我主要看你们的产品抽真空加保质期觉得不错，我到时外卖也会联系一些,福建的,好的稍等，同姓陈[握手]。"
正常,你好
正常,"包邮吗？,买多少钱的包邮,好的"
正常,"你好,牛多少钱一斤,西门牛"
正常,"老板，运费怎么算？,江苏省盐城市"
正常,怎么联系
正常,"在么亲,你这里啥苗适合我东北地区,你发个图片我看看,哪样的品种最适合？,零下20多度吧。,但是我现在那个有那种大棚，,就是种植上以后当年结果的得是几年的苗。,奥那行老板那么明白了,那个桑树。是不是有意适合东北的？,我看我们东北这边儿有送那个桑树的。,好的，好的。,这个桃树啥的，能不能数量就是选单科的。,因为我这是自己家吃自己种,不是卖,沂蒙霜红一颗。
大果桑一颗。
西梅一颗。都要当年挂果的,老板,对。,对老板，因为我这个吧是自己家吃。,那我再看看。,咱们这个不是卖就是吃。,对，刚才我看你那个简历上写的是什么"
正常,"老乡，其实可以多拍的素材,点"
正常,"你好！,老板:打算想要，但担心品质问题,贵州,我只是先试种一点，效果可以再多进点,杨梅有多大1粒,3年苗多少钱一棵,黑炭的多少钱1棵,包邮价吗？,东魁口味是带酸味吗？,两种的甜味那个深一点,能发邮政不,多少棵可以发,今年种，今年可以挂果吗,成活率包不,能不能先发3棵来看看,我已经付款了，能尽快发货吗？,谢谢老板，选好点的苗，下次会再合作的"
正常,"在,你好,买东西,你有喂猪的伺料吗,怎么购买啊,包邮吗？我要的比较多大概两千多,嗯，怎么买,小猪的,什么,嗯，可以"
正常,现在可以发货吗
风险,"订购量大优惠啊？,具体数量你方便加我老板微信啊？,聊一下"
正常,你好，你的鼓槌在景谷那里地址。
正常,"你好！,云胖6号适合云南建水这边种植吗？,一般情况下它的净穗有多重？,能把包装后面高清图给我看看吗？,这种玉米不知道抗不抗病和倒伏？,我看资料，你是在昆明经销,一般亩种几包？,哦！他在什么地方？多少一包,你不是说他帮你经销种子吗？,多少一袋？,建水的经销商？我也可能直接找他,那好！可能我理解错了,我想先试种半亩看看品性如何,我今天才下载客户端的。我以前没做过，先了解一下流程。我己经关注你了,你好！,是新种子吗"
正常,"在吗,多少起批啊"
正常,"你好老板,你好，你们沙糖桔在哪里？具体地址发给我一下好吗"
风险,"老板在吗,你们那边招代理吗，做代理有什么条件,方便的话加我一下꯭T꯭G꯭G꯭G꯭4꯭5꯭3有时平台没看到,我想一定会有个愉快的合作"
正常,你好，我想咨询一下你哪里是不是有小猪仔批发呀？
