正常,"欢迎光临本店，量大价格从优，支持惠农网在线交易，看到您的留言我将马上回复，您也可以选择来电咨询哦！,你好，这是78斤的,七八斤的，,好像还有6斤多的,大哥你要多大的,我看看有没有合适你要的重量,疫情影响，这鸡已经多养了两个月了,村里封路，进出两难,稍等，我给您问一下我老表,他养的，人老实，不会卖，我看的着急，我替他发的,我问下,马上回复你,哥哥,人可能睡觉了,你要多少只,明天我回复你好吗,价格差不多就行,把人都吃的乃不起了,好几千张嘴，光玉米都欠了快是万块钱,是的，公鸡,我舅家养的,要不，我打电话问下,你要"
正常,"118一桶吗？,在吗？"
风险,"老板，我想跟你确认一下产品特征，有最近拍的照片和视频吗？,这边什么时候能发货呢,你这边回消息有点慢,你要不家下我v,我们详聊一下,我在批发商,是,180,9801,5447"
正常,现在有货吗
正常,我已支付
风险,"你好，我是养殖业的,好的,一八九,二一五五,七三四五,微，信，,嗯嗯"
风险,"你好,蠡玉16怎么卖,湖北,50袋, 是正品吗,成活率怎么样,您贵姓,张志华,隆两优华占有没有,谷种,好的，快递多久到,蠡玉88有没有,发邮政可以吗,邮费要多少钱50袋,因为疫情我这边封路,我问好物流了在联系你,电话是您微信我加下,加了,蠡玉16"
正常,在？海南包邮吗
正常,好的，谢谢！
正常,"包邮吗？购买后多久发货？,你好,在嘛,你们我们是大学生，我们在搞项目运营,我们想把您的货上到我们的app上售卖，您看可以吗,大部分都是发山东,我们是山东青岛的,好的谢谢,水果包邮嘛,哥,哥你去哪了呀"
正常,"你们这个一般怎么发货那？,我这是新疆的,现在想问一下物流这块怎么弄,想的1000斤,这块包装怎么弄，"
正常,贵州发货么
正常,量大有优惠吗？
正常,包送货吗？
风险,"你好是厂家老板吗,量多有优惠吗？可以长期合作。,好的，你加微信吧,150224,59274,发一个订单表给你。,加了吗"
正常,"在吗,胡萝卜有货吗？"
正常,"？,红色？,几个月,疫苗齐全？"
风险,"武汉市汉阳区发货不？社区团购！,好的，我统计一下团购量！微信号发我，我加你！,我是社区团购单，需要时间组团，统计，收款，后才能下订！,比较麻烦，可以发货就行，统计好，我再联系你下订，打扰了！[握手][握手],好的，谢谢了"
正常,您好，京东物流，是否有发货需求可与我联系
正常,"有几重一只,老板，运费怎么算？,最低批发价多少？,运费什么计？,老板，运费怎么算？"
正常,有几板子
正常,苹果多少钱拉
正常,"三相电,带电机,是铜芯电机吗？,运费是包邮是吗？,好的那我考虑一下在联系"
正常,水田能做业吗？有座位座在后面吗？
风险,"老板,有双赢个生意打你谈下,以免平台没看到消息，请加下tggg453好联系,我想一定会有个愉快的合作"
正常,"老板，运费怎么算？,老板，运费怎么算？,最低批发价多少？"
正常,"你好:blush:,黑龙江包邮吗,走什么快递,10斤,OK"
正常,现在还有货吗？
正常,"在吗,提交不了"
正常,"你好,我们现在想做个活动都是山东半岛的，如果我们需要采购能直接联系您嘛，您的价格不会变吧，货您是有的吧,你们包邮嘛"
风险,"在吗？,我要有货有些多，支持视频看货吗,如可以请加Tggg453满意我立马平台订货"
正常,"什么时候能发货,什么快递"
正常,湘蕾品种是树型吗？
正常,"118一桶吗？,在吗？"
正常,"你好,现在有苗么？,草鱼鲤鱼鲫鱼,普定的,你哪里是哪里,近一点的话，我自己去拉也可以,不是很多,差不多吧,嗯嗯,发不了电话，,哦哦,1596875,6602,你哪里近么，如果在安顺我可以跑过去自己拿也许,OK,兄弟，刚刚是你打电话给我么？,要不你加我吧，刚刚不小心把通话记录删除了[流泪],帮我带，鲫鱼草鱼，鲤鱼一样一千条，花鲢带两百条怎么样,你好，在吗？"
风险,"老板在吗,你们那边招代理吗，做代理有什么条件,方便的话加我一下Tggg453有时平台没看到,我想一定会有个愉快的合作"
正常,"3只起卖吗,最低批发价多少？"
正常,"你好,龙九通货什么价？,好块，最起码没沟没眼吧,通货,能发些照片看看货吗？你发的这个三毛的是什么质量,大概什么质量什么价？,给帮发货吗？,我山东聊城"
正常,"在吗,怎么看评论说不让养了？,好,好养殖吗,怎么合作，怎么回收"
正常,"是的,多少钱一斤,包邮吗,包邮多少,我只要几500斤左右,那好，谢谢"
风险,"你要多少？,你好,我们是鸡场直销的,我们鸡场在三水的,你在那里？,哦，运费不合适,可以给你介绍一个在广州的批发商,包邮吗？购买后多久发货？,136,00316240,加V,:heavy_plus_sign:"
风险,"嗨

在吗,你是哪里藕,你不是云南吗,外省藕我们市场近来不了,云南昆明,电话联系

微信联系也行"
风险,"你好,我想大面积种植蓝莓,想了解一下树苗,180,58196162  ,我开车呢家有微信,加了嘛？,加了告诉我通过,我不方便现在,那算了下班吧"
风险,"你好,怎么才能跟您联系上,我是吉林电视台的汪大元,我需要贵妃芒,gy,26887077,vx,你好,加我,yi ba ling si san yi san er jiu san san"
正常,什么时候发货？
正常,"在吗,价格多少钱呢,每斤"
正常,"什么鹅,多少天的,包邮吗？购买后多久发货？,老板，运费怎么算？"
正常,在吗老板
正常,"你好，你好！,你那里是不是有桂苗卖呀？,你那里是哪里呀？,多少钱一条？,大概有多高。,多少年的苗？"
风险,"欢迎光临本店，量大价格从优，支持惠农网在线交易，看到您的留言我将马上回复，您也可以选择来电咨询哦！,有的，方便＋微信商议嘛？,152,6830,8761,我在四川自贡富顺,好的"
正常,你好，现在开工了吗
正常,"大米多钱批发？,运费多钱？,葫芦岛,是的,一吨？,嗯嗯,乘车是多少,质量怎样？,太多,大米,嗯嗯"
正常,"你好,拿多价格怎么算的"
正常,"到广州南沙区运费多少？,100斤的"
风险,"你好，刚看到，不好意思哈，你方便可以加我一下
136 892
 33 250
维心名字叫 奈何桥的轮回 。我忙完了看到给你回消息，
你加完给我说一下哪个是你就行,136 892
 33 250
维心名字叫 奈何桥的轮回 。我忙完了看到给你回消息，
你加完给我说一下哪个是你就行"
正常,"你好,我想买小母牛，西门达尔多少一斤"
风险,"老板在吗,你方便的话加我一下tggg453有时平台没看到们那边招代理吗，做代理有什么条件"
正常,请问这个赤小豆能当种子用吗？
正常,"到福州多少起？运费怎么算？,老板，运费怎么算？,我先拿个10条看看,什么时候可以发货,好的,包邮吗？购买后多久发货？,粮票在那里？,没有发现呀，第一次用这个,包邮吗？购买后多久发货？,收到，谢谢,货好，我们长期合作[大笑],[握手][握手],你好，你后期发过来的，不要贴你们的二维码,包邮吗？购买后多久发货？,下单了，不要贴标签,好的，谢谢,包邮吗？购买后多久发货？,黄瓜鱼干的话是独立包装还是散装,包邮吗？购买后多久发货？,有没有其他鱼类？,好的"
风险,"你好，你们那有三元小猪吗,我们是达州渠县的养猪场！现需要一批三元小猪！,132－8172－3858,可以电话联系"
正常,你好！
风险,"老板要沃柑,要多少斤,老板问加一下你微信"
正常,"你好,好收到谢谢,请急时发货,什么快递,好再见"
风险,"你好在吗,李子苗,加我微信细聊一下,我需要大批量"
正常,收购吗
风险,"在吗？,找您订些货，湖北可以发吗,可以的话薇tggg453我们具体谈下,谢谢"
风险,"80以上2.8吗,188,98516365"
正常,我在采购圣女果，您有现货吗？价格多少？
正常,"批发么,有多少"
正常,"去皮萝卜丝什么价格？？,货多？？我要几吨,几吨是什么价格？"
正常,"如果今年我在你那边买草莓苗，你那边能不能介绍种草莓的师傅，我自己技术不行,我要的是那种可以在我的草莓地现场指导兼干活的那种，我开工资"
正常,300一只多重
正常,"你好,罗汉果花叶病有什么药可以亏防治？"
风险,"你好？,我如可以请加tggg453满意我立马平台订货要有货有些多，支持视频看货吗,我要有货有些多，支持视频看货吗,谢谢"
正常,"什么价？,在吗"
风险,"老板在吗,你们那边招代理吗，做代理有什么条件,方便的话加我一下Tggg453有时平台没看到"
风险,"你好,重楼苗多少钱一颗,你微信多少,地址是哪里,我加你了"
正常,"什么快递,物流运费多少？快递包邮吗,你好怎么付款"
正常,"在不,都是下单哪四个,嗯,嗯，我看看,最低200棵,要不了那么多,你的意思我下单一个品种，你帮我寄,是吗,嗯嗯，,我看看,这样可以给你刷单是吗，就是麻烦点,还要填地址，还要绑定卡,[大笑],嗯，,直接钱发给你吧，这样就是你的钱,[大笑]"
正常,"我想要批发斗鱼,批发半月，狮王，还有马尾"
正常,地膜多少钱，1斤
正常,"想了解一下的,还没想好呢"
正常,"一块多少克,多少g啊"
正常,你好，地径1公分，高度1.2m的大概什么价格？含运费
正常,首单标注的不是9.9元吗
正常,你的鱼大概都是一斤多的吗！没有两斤多的吗
正常,"感谢您的报价，另外您对本次报价还有什么要补充的可以留言给我，如果货品、价格合适，我会主动联系您。,你好,多大,多少钱一个,一千四的好多斤座右嘛,不会低于20斤塞,OK    我先商量一下   等下给你答复,对了   要得多有优惠没得,OK,贵了,后面有个人给我报价是30斤1200多一斤17块,最近   圈舍还没弄好,重庆    最起码 50个,可以"
正常,看图片猪板油很好，都是找么大片厚实的吗？如果是我想大量收购
正常,"肉桂,桂皮的肉桂,哦"
正常,这鸡苗怎么卖的？？？
正常,"任总你好！陆川猪种是否纯正？母猪苗三十斤以上怎么卖？,最低批发价多少？,老板，运费怎么算？"
风险,"您好,我是郑州了,如果代卖你的水果头一天报单几天能到郑州,哦,我们代购3到4天有点晚了,这路上水果质量也得不到保证,打扰了,草莓:strawberry:能隔日到吗？,我加你V信吧,你通过一下吧！"
正常,"你这个这么贵,零售也贵啊"
正常,"嗯想买一台，喂牛用,三相电的，带插速器的,你发个260,我看看,把你电话号码发过来,得咋么交易呢,货到付款,260最低价多少钱,贵了,小点,我头几天在百度上找了一个,行先唠到这，你是厂家还是代销商,吉林省桦甸市,厂名"
正常,"欢迎光临本店，量大价格从优，支持惠农网在线交易，看到您的留言我将马上回复，您也可以选择来电咨询哦！,4斤,可以,东华北，西北国审,不拆袋，一袋四斤,下单就可以,在产品界面选择规格，数量，填上你的地址电话，付款就可以了，和淘宝一样。,是这个定单链接的在线支付就对了,和淘宝一样，你收货后款才打给我,放心，大厂家品种，纯度芽率都非常好，真空包装，都是中间粒特别匀,你的地址没有乡镇吗？,地址一定要准啊,我知道，我发的就是邮政小包，我的意思是不写乡镇能找到你的村吗？别发不到只到县里就麻烦了,那我就按你写的发了"
正常,"怎么发货,最低多钱,最低要多少,发货,运费是谁的？,散装的还是箱装？"
风险,"在,卖1000么,？,樟树市,江西,包邮吗？购买后多久发货？,这不是八分啊,哦,？,几时发货,那我直接到这上面购买？,不是这上面付款？,微信付款没保障？,要不你发个淘宝链接"
正常,"你好,黄豆蛋白咋样,我做豆腐用"
正常,"价格还可以便宜点吗？,两年苗栽了后几年挂果？四川丘林地带适合种吗？,己下单，先试种，看苗情况，下年再决定是否大面积种"
正常,"土豆什么时候有货？,老板，我想跟你确认一下产品特征，有最近拍的照片和视频吗？,价格还可以便宜点吗？"
正常,"嫁接过的吗？,我要不嫁接的,有种子吗？,我要便宜点的"
正常,"老板，你这三华李苗是早熟那种吗,一亩地种多少棵，早熟是几月份到几月份迟熟几月份到几月份？"
风险,"在吗？,找您订些货，湖北可以发吗,可以的话薇tggg453我们具体谈下,谢谢"
正常,产品质量怎么样
风险,"你好批发多少钱,加微信详细谈吧，行了,180,581,961,62,谢谢,加了吗"
正常,"你好，请问你们的鸡蛋均是土鸡蛋吗？,？,哦！好的,我以为是散养的,多少一箱？,一箱有多少个？,蛋大还是小？"
正常,怎么联系你
正常,苹果多少一斤
正常,"你好，请问湖北鄂州可以发货吗,包邮吗,能不能保证质量,买多少才能包邮？,你们发的是什么快递？,在吗？,好的，一箱25块钱有多少斤"
正常,木波萝
正常,多少斤批，
正常,"50斤的有吗,有没有小点的"
正常,"什么价？,在吗"
风险,"在吗,我们想批发一些柑橘,你是老板吗,老板，我想跟你确认一下产品特征，有最近拍的照片和视频吗？,那你可以加我们负责人v,好的,具体他会跟你谈,不是"
风险,"如果您对我的报价感兴趣，请点击我的头像进入店铺查看货品或致电给我。,你好,您方便留个:phone:️吗？,我:phone:️跟您沟通吧"
正常,我也某色哪种是哪种
正常,"是你的店吗,弄的收货人姓名[可爱],核桃苗有多少,看你销量不错了,重十来亩地需要多少棵,一亩地才60-70棵太稀了吧了吧,一棵苗多少钱,这苗得几年挂果,好了老板今天不早了，明天再谈,我看你的樱桃面也挺好，品种有保障吧买多要优惠一点哈,行，要保证质量，不讲价了，发货时多发个10棵20棵的就行了,尽快发货哈"
风险,"在吗,包邮吗？购买后多久发货？,156879,23306,昵称舍不得忘记你，备注备注一下店铺名,方便以后合作,江西的,行，这里不经常上,你:heavy_plus_sign:,小包装就行,包邮吗？购买后多久发货？,好的"
风险,"老板，可以到产地看货吗？,还在？,麻烦加一下v pangxiang123321,等疫情结束了，再选个时间看,加了吗，你微信名是多少"
正常,"你好,一箱是包邮的吗"
正常,"随便看看,嗯,不是"
正常,"1350,批发二十头以上。全母，十多二十斤"
正常,"下单后预计什么时候发货,OK,不需要了，谢谢"
正常,"谢谢，我先看看，不知道要种啥,刚下载的软件，我先看看爱,好的"
风险,"在吗？,我要有货有些多，支持视频看货吗,如可以请加tggg453满意我立马平台订货,谢谢"
风险,"欢迎光临本店，量大价格从优，支持惠农网在线交易，看到您的留言我将马上回复，您也可以选择来电咨询哦！,哪个厚度,OK,0.2mm的一平1.9元  0.3mm 的一平2.9元 0.5mm 的一平米4.9元,100,物流业内都是到付,如果是一平米的话不用你拿运费，兄弟给你包了,大哥要不这样吧，我留你个微信，下午我给你算一下，你看可以不,大哥那上边的是我的，您受累加一下吧"
正常,"你好，有货吗？,多少一斤？,还是按箱？"
风险,"你电话号码是多少,好的"
正常,"湖北黄冈发货吗,老板，这个成活率怎么样？,两年的什么价,两百棵,有优惠吗,好的谢谢,是有购买嫁接的油茶苗意向,二百棵,可以同时发两个品种的苗木吧,请问两个什么品种的,如何区分开来,还有其他的品种的吗,哦,四号皮厚点,出油率低,比较而宫的,。好的,湖北黄冈这边能发货吗,我十六号你那边的不能过来之后退款了"
正常,好的，谢谢！
正常,"你好,想要桔子"
风险,"你好,你那有鸡蛋批发是吗,你好,阳春,你连系电话几多,好的,加你微信"
正常,"老板，运费怎么算？,老板，运费怎么算？,老板，运费怎么算？,老板，运费怎么算？,老板，运费怎么算？,最低批发价多少？"
正常,"你好，我买的是同一品种，会不会存在不是异花授粉导致产量低的问题呢,好的，我先在自家院子种几棵看看，理想的话再扩大种植,你好，我想了解一下，我这个地区的年冷量只有250小时，是不是不适宜种植这个恐龙蛋品种啊"
正常,"最低批发价多少？,你那仔猪什幺价"
正常,"我想问一下苦笋好吃不好吃,苦笋真的一块八毛钱一斤吗"
正常,"欢迎光临本店，量大价格从优，支持惠农网在线交易，看到您的留言我将马上回复，您也可以选择来电咨询哦！,4斤,可以,东华北，西北国审,不拆袋，一袋四斤,下单就可以,在产品界面选择规格，数量，填上你的地址电话，付款就可以了，和淘宝一样。,是这个定单链接的在线支付就对了,和淘宝一样，你收货后款才打给我,放心，大厂家品种，纯度芽率都非常好，真空包装，都是中间粒特别匀,你的地址没有乡镇吗？,地址一定要准啊,我知道，我发的就是邮政小包，我的意思是不写乡镇能找到你的村吗？别发不到只到县里就麻烦了,那我就按你写的发了"
正常,早上好
风险,"你好老板，你家果园地址在哪里呀？,现在可以进村吗？,南宁，拿来吃的。几十斤吧,能寄重庆吗？,微信多少，加个微信"
正常,"感谢您的报价，另外您对本次报价还有什么要补充的可以留言给我，如果货品、价格合适，我会主动联系您。,你好,有猪苗？,嗯嗯,多少斤的多大了？,什么品种？,抗病怎么样？,我不懂，我第一次养,这个可以留母猪苗吗,种猪,阉割了？,为啥？,不能生？,这个还真不知道,想要白色的,二元母猪下的多吗？,这个二元跟三元是以什么方面定义的？"
正常,老板，还没发货吗
正常,打电话打不通
正常,"包邮吗？购买后多久发货？,您好,请问您那里有仔猪卖么,10头卖么,价格是？,张家界,我可以自己带走,那价格是？,价格还可以便宜点吗？,没有小点的么,[呲牙],价格还可以便宜点吗？,不好意思,每次点错,第一次用这个app,我先问下我妈……她说大的不好用车带回去，要小点的才可以。,到时候如果需要，再联系您,谢谢,20斤左右的多少钱,10只两个小车拖，太多了也拖不回去呀,想买小点的，自己可以用小车，一辆车5个就能带回去了"
正常,您好，是散装还是箱装？
正常,"35是公斤,还是市斤"
正常,多少钱一斤
正常,"武汉能发货了吗,【发什么快递】,武汉发货吗？,在吗？"
正常,"请问运费怎么算,运费到新洲阳逻大概多少钱,按2000斤算的话,平时的话呢"
正常,云南发货吗？
正常,"老板，我想跟你确认一下产品特征，有最近拍的照片和视频吗？,包邮吗？购买后多久发货？,陈老板在吗,生意兴隆啊,哦,电话吗？,好吧"
风险,"在吗,我想要买红薯,请问可以微信支付吗,180580,36875,你加我的微信号"
正常,你是有杉木一苗一实吗？我要卖
正常,老板你好，
正常,"适合江西上饶天气吗,需要搭棚吗,什么时候可以发货,种植需要什么技术吗,那行等过两天，这边下雨"
正常,"大白菜量大吗？,四千到六千吨。,做泡菜用。,怎么不说话呢？给我一个报价,一八零,四七九一,二一一一"
正常,可以发货
风险,"你好,我刚加这个网站没弄明白,加微信聊聊吧,要   爸 爸   刘山  爸舅  舅  舅  刘  爸"
正常,"南宫什么地方？我去看看,好的，谢谢,给我发个电话我去了好找你,我的钱还走线上"
正常,"你好 能看一下竖切照片吗 ,1000斤以上,需求,这个就是"
正常,大果一个大概多大
正常,"你家是真的吗,樱桃苗吗,上面是假苗谁知道,无良商家太多,因为买几次都是假苗,假苗,樱花"
正常,"你好,运费算谁的老板"
正常,"到福州多少起？运费怎么算？,老板，运费怎么算？,我先拿个10条看看,什么时候可以发货,好的,包邮吗？购买后多久发货？,粮票在那里？,没有发现呀，第一次用这个,包邮吗？购买后多久发货？,收到，谢谢,货好，我们长期合作[大笑],[握手][握手],你好，你后期发过来的，不要贴你们的二维码,包邮吗？购买后多久发货？,下单了，不要贴标签,好的，谢谢,包邮吗？购买后多久发货？,黄瓜鱼干的话是独立包装还是散装,包邮吗？购买后多久发货？,有没有其他鱼类？,好的"
正常,"你好,你这生姜按斤论吗,还是？,一斤一元吗,姜种对吗,你那里？,奥，好吧，北方人都会做生意,已加,麻烦接受下"
风险,"我想问一下,你们这个,可以用卫星支付嘛？,微信支付可以吗？,100颗,180:grin:58:grin:0:grin:36:grin:87:grin:5,你先加我吧,加了嘛？"
正常,"10元每斤？,老板，你发货地在哪？"
风险,"批发么,你是负责人么,这样你加我们老板微具体多少他更谈,可以么,1884108,2009,加上了么亲,什么玩意"
风险,"一元钱吗,嗯,联系方式有吗,好的"
正常,"有坏果怎么办,包运费吗,运费大概要多少,发重庆,先25000斤,自己来拉可以不,你们有箱子装好的吗,多少钱一个"
正常,"您好,一件几斤"
正常,"老板，我想跟你确认一下产品特征，有最近拍的照片和视频吗？,老板你好 我前天看你 好像不是这个价格是吧？"
正常,"果子质量如何？,什么时候发货？"
风险,"你好,我想咨询一下你家的这款产品,1858196162,我微信号，你加我一下我一会联系你"
正常,"大白菜量大吗？,四千到六千吨。,做泡菜用。,怎么不说话呢？给我一个报价,一八零,四七九一,二一一一"
正常,"500一只吗
,意思涨价了,[汗][汗],你那有多少只,怎么运输,怎么交易呢,没去过有点担心呀
,加了"
正常,"价格怎么算？20到30斤,不会吧，40斤才800?,确定我要100头"
正常,老板知道扬州有野生黄鳝泥鳅收购商吗
正常,"你好,多少钱一吨,还能不能便宜点,我回来卖可以吗？,河北邯郸,往邯郸发过货吗？"
正常,"什么时候发货,老板我的枇杷苗发货了吗,大约几天到"
正常,"你好,多少钱一吨,包运费吗，宜宾这边"
风险,"老板在吗,方便的话加我一下tggg453有时平台没看到"
正常,"你好,多少发货"
正常,50棵卖吗
正常,"在吗,我想做代理,你家卖几年了,你这个货怎么样,你家价格,然后包邮吗,我这里温州,我自己买点吃，好的话我做代理,以后长期合作"
风险,"老板在吗,你们那边招代理吗，做代理有什么条件,方便的话加我一下tggg453有时平台没看到,谢谢"
风险,"您这是批发么,这样吧 加个微信吧 ,您的微信给我我加您"
风险,"好的，可以加你微信嘛,怎么加你,我想找你合作,我也是古田的,打算卖银耳"
风险,"我想要大量的的珠芽黄魔芋,你好我们可以电话聊吗,可以"
正常,"您好,请问可以混批吗？"
风险,"你好,清远麻鸡5.5元一斤吗,好,加微信用户不存在"
正常,"问下下完单多久发货啊,今天能发货吗？顾客着急,订单号？"
正常,"有现货  我这边是8－10公分的,价格的话我是第一次卖 你看你能给多少,能给多少钱"
风险,"老板，运费怎么算？,最低批发价多少？,长期合作那种,说不上多少箱,广东惠州,物流怎么算,批发零售一起,微信,178,1753,7669,张"
正常,一件多少斤
风险,"在么？,牛排14一斤么,电话号码多少"
正常,"老板，你们柴胡是哪里的，,你能不能给个号码联系。"
正常,您好，您需要浇地布水带批发各种尺寸
正常,什么价格？25/30斤母猪
风险,联系方式给一个
正常,在没？？
正常,先看看
正常,你好，韭菜头茬，二茬的
正常,你那的白菜多少钱一斤
正常,"一代有多少公斤,多少钱一吨"
正常,"土豆什么时候有货？,老板，我想跟你确认一下产品特征，有最近拍的照片和视频吗？,价格还可以便宜点吗？"
风险,"亲，在吗？,现在发不发货,是这样，我要的数量很大，方便+微说么？"
正常,"你好,包邮吗？购买后多久发货？,五斤的"
正常,"包邮吗？,这个品种怎么样？,还有别的品种吗？,现在种可以吗？,早吧,你上面的所有品种我各要一个，能不能便宜点,十颗啊,包活吗,当年挂果？,我怎么给你转钱,能不能给我在赠颗别的果苗,冬桃是冬天结果吗？,那你给我赠颗冬桃吧？,已支付了,如果好，我大面积栽种，你那提供技术吗？,好的,你加我微信吧，方便以后联系"
正常,"你好,怎么批发？,一斤？,哦,代理怎么做,7，5一斤零售？,在我们这边卖不出去，我们只是个小镇，没有这么高的消费,[可爱][可爱]销售不出去"
正常,"你好, 什么时间发货呢？规格多大？有没有虫眼？内腐烂大不大？白洋姜有现货吗？有多少？包邮吗？上车什么价？,今年五万吨 能供应嘛"
正常,"沉香小苗多少钱一棵？,20000,电白,太贵,价钱相差太远，无法谈"
正常,一箱多少朵
风险,"你好！在吗,1342634,7316,请快速回话。"
正常,"多少钱一斤,有一个品种,都多少钱,什么区别,品种都叫啥名,226是.95,大小都是多大"
