正常,"欢迎光临本店，量大价格从优，支持惠农网在线交易，看到您的留言我将马上回复，您也可以选择来电咨询哦！,老板你好，瘦肉多少钱"
正常,你好，需要大蒜吗？
正常,你好，需要皂角树苗吗
正常,"老板，你发货地在哪？,你可以帮忙安排一下货运吗？,我们广安,因现在已封，过段时间来出货,欢迎光临本店，量大价格从优，支持惠农网在线交易，看到您的留言我将马上回复，您也可以选择来电咨询哦！"
风险,"陈总你好，本苗场专业种植杨梅苗，品种和规格齐全，欢迎你的采购，谢谢,陈老板你好，我的苗场品种有荸荠种，乌梅种，东槐种，水晶种，粉红种，黑炭种。欢迎你的采购，谢谢。,陈总你好，新年快乐。"
风险,"你好,我是负责采购的  你这里能大批量的出售吗"
风险,"老板家的产品方便加个微信了解下吗
聊好了可在这里下单
我是省内批发商方便的话也可以实地去看
18
245
736
479
客户比较多，家的时候麻烦备注下,这样子啊  我是 因为我这回复 不方便 客户消息多 ,嗯嗯  没事"
正常,"48小时内发货,什么时候发货呀，都4天了,什么时候发货？,目前已陆续安排发货亲,这个我只收到一箱呢！你发的一箱还是两箱,两箱，分开发的亲,正常发货,收到,什么时候发货？,亲亲由于疫情原因导致发货延迟，发货时间另行通知，希望您理解，再次提醒各位亲出门记得戴口罩，勤洗手，注意身体健康！！,今天能发货吗,哦，好的"
风险,"你好,这个枣每次可以发多少,甜不甜,只要质量好,要的比那多,等一下我问问,给三个酒店搞得,方便加个我们主管v吗,136
8031
5968,陈主管,我在找货，他具体谈。,我估计至少80斤以上,行，你加了说一声，我发消息让他给你通过。,你稍等一下啊
还没回我
可能在忙,他回了我让他通过,好"
风险,需要的时候肯定联系老板
风险,"你好在吗,亲可以长期供货吗,看你们俩质量挺好的,打算长期合作"
正常,需要咨询机器吗？
风险,"包邮吗？购买后多久发货？,在哪里,那可以先加个微信吗,到时候过了疫情联系,你加我吧 加了说一下我好备注"
风险,"欢迎光临本店，量大价格从优，支持惠农网在线交易，看到您的留言我将马上回复，您也可以选择来电咨询哦！,你还没同意"
风险,"在吗,你好，可以发货了吗,方便:heavy_plus_sign:我爸微心吗"
正常,"我们为了保证苗子的成活率都是现挖现发的  并且带有生根粉和肥料发货的  ,你好老板 ,请问你需要什么果树苗"
风险,"本人电,最便宜的小干鱼几块一斤,你好，有,159199251,87,欢迎光临本店，量大价格从优，支持惠农网在线交易，看到您的留言我将马上回复，您也可以选择来电咨询哦！,长年有货吗,正常1元左右,湖南发货几块一斤"
正常,"你好,运送费是包运吗,我每年要十来吨"
风险,"问问你那苹果咋卖,4箱,多少钱一箱,你是老板,不能便宜了吗,那你先加我个V信吧,河北,150,我在看看，没有在这里买过,474,77434,你加我吧，需要我在联系你，没有在这里买f过东西,有点不放心,同事说，这里买东西便宜"
风险,"价格还可以便宜点吗？,151
9199
4794
＋薇-信说,你好，可以确认下产品吗
151
9199
4794
＋薇-信说，手机没电
,好的明白 加我详谈下细节"
风险,"你好我想知道批量采购定制会有优惠嘛,1000,:accept:以wx付款嘛"
正常,"好的，谢谢,欢迎光临本店，量大价格从优，支持惠农网在线交易，看到您的留言我将马上回复，您也可以选择来电咨询哦！,老顾客，上次差半天没优惠，现在新冠状肺炎闹的厉害，没生意，想买一瓶二斤装的，帮我包邮一下老板，谢谢了,您好！我这边现在最近发不了货，所以上线比较少！请多多理解！,我是您的老顾客,能发货了我再帮您发，好吗？"
风险,"在,结果率高吗,成活率呢,您哪的,可以实地考察嘛,好的,haonvren411748,添加,有些字这边不能说,详聊,？"
正常,"包邮吗？购买后多久发货？,老板，我想跟你确认一下产品特征，有最近拍的照片和视频吗？"
风险,"在,181,老板，番薯批发什么价格,76776768,欢迎光临本店，量大价格从优，支持惠农网在线交易，看到您的留言我将马上回复，您也可以选择来电咨询哦！"
风险,"买的多可以打折吗？,好的,可以加吗？,以后好聊,哦哦,好"
风险,"您好，我是周围城市的批发商，您家产品很不错，我想和您合作采购大量
谈好了可以在这里拍商品，您伽我微信
167~1067~6495,你加我我微信被限制了家不了人"
正常,"你好，需要板栗树苗吗？,保证质量，保证纯度，规格齐全，保证成活，保湿发货，包邮"
正常,"欢迎光临本店，量大价格从优，支持惠农网在线交易，看到您的留言我将马上回复，您也可以选择来电咨询哦！,产地在哪？"
风险,"在吗？,我要有货有些多，支持视频看货吗,如可以请加Tggg453满意我立马平台订货"
风险,"老板家的产品方便加个微信了解下吗
聊好了可在这里下单
我这加客户过多被限制麻烦您+我了
1672~513~25~69,不好意思 我这客户太多 消息回不了 而且 我要量   如果你担心的话 打扰了 老板"
风险,"感谢您的报价，另外您对本次报价还有什么要补充的可以留言给我，如果货品、价格合适，我会主动联系您。,你好。,你好,137
2158
9569"
正常,"批发  红桔种子  枳壳种子  酸柚种子  柠檬种子  毛桃种子  枳橙种子  酸梅种子  马甲种子  黄皮果种子  香橙种子 柿子种子等各种嫁接砧木种子：可以提供种子播种育苗技术支持；本苗场另有红桔苗  枳壳苗  酸柑苗  香橙苗 枳橙苗 毛桃苗  酸柚苗  杨梅苗  板栗苗  棠梨苗 甜茶苗【苹果砧木】山楂苗  柠檬苗 酸梅苗 油茶苗 各种砧木直生苗！

嫁接苗：沃柑.沙糖桔 李子苗.板栗苗.柿子
苗 拱棚杆等

可以提供种植技术
支持！欢迎各地种植农户和老
板前来苗场看苗起苗。
 
阳朔九九农业科技发展有限公司   苏定华"
正常,"收到,什么时候、到货,收到不甜[可爱][可爱],今天发货,预计2天左右,您好水果收到了吗,不甜吗"
风险,"在吗,方便＋wx沟通吗,13382
660979"
正常,老板你好，需要耙耙柑苗吗
风险,"批发苹果，澄心批发,60133610486！加我媳妇的微信吧！我不经常在线，加了，麻烦告知一声"
风险,"你好,我们老板，想找新的供应商合作，方便让你们负责人或老板加一下v吗！详谈一下。"
风险,"老板，果苗批发不,包邮吗？购买后多久发货？,我姐家院子采购,您是负责人嘛,135,7847,9237,麻烦嘉下我姐V,发下苗木品种，数量,老板，嘉了吗,我喊她通过您,老板，嘉了没有呢[可爱],回复一下哦,包邮吗？购买后多久发货？,老板，嘉了没有呢,加了吗，老板,您回复个加了,我让我姐加你,老板，加了吗,加了吗，老板[嘘],因为我姐要看我有没有认真的找到批发加,批发价格,您就回复个加了,我喊让她加您，她也在对比价格这些啦,包邮吗？购买后多久发货？,老板，加了吗,可以的,您就回复个加了,不要让我为难啦,哎呀,你打加了两个字好容易嘛,拜托啦，老板"
风险,"我这个是平潭2号的改良品种，不过我们这边叫501,你好，我刚打了你的电话，但是你没接，期待你给我回复。,欢迎光临本店，量大价格从优，支持惠农网在线交易，看到您的留言我将马上回复，您也可以选择来电咨询哦！,你好,你那木麻黄是什么品种？什么价？,1372472,有吗？什么价？,9988"
风险,郭总你好，本苗场专业种植杨梅苗，品种和规格齐全，欢迎你的采购，谢谢你的关心
风险,"你好老板，你家货物不错，能大量合作嘛
茄我维信谈谈怎么合作,物流价格等
1513
2475
753, 老板  加我微信详谈 可以合作 一起牛喔"
风险,"周老板你好，本苗场专业种植杨梅苗，品种齐全，规格多，欢迎你的采购，谢谢，祝新年快乐。,丿"
正常,你好欢迎咨询我们公司
风险,"老板您好，我是你周围城市的批发商，您家产品很不错，我想和您合作大量采购
谈好了可以在这里拍商品
加我这个威**信
167~~2513~~2478
茄的时候备注下你卖什么的。.,是的 我需要 加我了吗"
风险,"你好 在吗,我想订购一批,可以发货吗,我是帮朋友订购,大概70/90箱,你好,你这边方便让老板负责人加一下v吧,1522638,9339"
正常,"运费怎么算？售后有保障吗？,老板，我直接付款也不行吧！你到时候也要找我要运费啊！,欢迎光临本店，量大价格从优，支持惠农网在线交易，看到您的留言我将马上回复，您也可以选择来电咨询哦！"
风险,"您好，我是采购商，您家产品很不错，我想和您合作采购大量
谈好了可以在这里拍商品，您加我维信详谈
167
1067
6480
给我一次机会，换来一次合作,我只在微信谈 这里交易的老板 ,好的老板 你不方便那算了"
风险,"你好！在吗,1342634,7316,请快速回话。"
风险,"你好,你先加下我吧  我取下手机去,17185,154565,我的v,加上了吗,加了吗"
正常,还没开
风险,请问你是老板还是负责人
风险,"你好！,我们店里需要进一些东西，,量比较大,能加一下我们老板的v吗？,让我们老板定,具体我不知道要多少,但我真的不知道要多少货,我们老板说加v，他定,他不让我们员工下,他忙，要不然也不会让我们员工来帮忙,但需要货啊！病情一过,货我们不够,1－378－514－640－4,这是v号，中间那个干号没有的，你就加一下，,聊一下嘛，真的需要您的货"
正常,"几号能出货,正月十六,欢迎光临本店，量大价格从优，支持惠农网在线交易，看到您的留言我将马上回复，您也可以选择来电咨询哦！,你好,你好"
正常,"我在采购猪苗，您有现货吗？价格多少？,有现货，四五十斤左右的在一千五一头。"
正常,你好老板，需要杨梅树苗吗
风险,"几号有？,具体时间，在联系你,暂时没有，厂还没上班,还没,178705816,32,现在有货吗,欢迎光临本店，量大价格从优，支持惠农网在线交易，看到您的留言我将马上回复，您也可以选择来电咨询哦！,下个星期开始生产,老板发个你的联系方式给我，有货我通知你,有货吗？,老板是哪里的,现在会没有,可添加我好友,赣州会昌,三月上班,方便通知,没有的,现在有货吗,你好,豆渣"
正常,"欢迎光临本店，量大价格从优，支持惠农网在线交易，看到您的留言我将马上回复，您也可以选择来电咨询哦！,还有货吗？,有"
风险,"开工了吗？,我们是超市采购,大概得要1000公斤左右,我们是之前的供应商断货了,现在需要寻求新的供应商,具体的数量可以商量,主要是看产品的质量,方便的话你们可以加一下我们负责人的v:yang917128550 详谈一下,加了吗？"
正常,你好，我看你需要黑子石榴苗
风险,"顺丰可以发吧,需要啥品种货？,你好,老板你需要？,不过亲放心，保质保量，到货后如果觉得不满意，亲无条件支持退货，,有货，,还在,你下单看地址,可以， ,暂不支持货到付款,当归，当归苗，淫羊藿？？,好的，我现在处理一下,处理的了吗，处理不了的话我去看看别的吧,都有现货，,是啊,等下联系你吧亲,有现货吗,怎么这样,很不好意思，我这边提示系统维护，,还是付款不了,那你就把顺丰的邮费加上去,？,好了吗,不会吧,客服怎么说,最近物流公司停运，等疫情结束后才能给亲发货,可以顺丰到付,你好在吗,我这边确实后台提示系统维护,当归,下单了,系统维护"
正常,需要咨询机器吗
正常,"感谢新老客户照顾生意
我们推出优惠活动限量[100条金鲳鱼鱼干][包邮]
[原价27元一条]现在只要[24.5一条]
欢迎来购买
"
正常,需要联系哦
风险," 在吗,一只鸡多少斤,下班了吗,我老婆坐月子要40只,有优惠不,可以,加我微信,135345
47217,备注惠农合哦,在吗,加我一下亲。准备睡觉了"
正常,"我给您退差价,与一元硬币比较呢,12元,好嘞大哥,有脆枣吗,刚看到,谢谢你了！,货发了吗,好的,熊发货吗,有图片吗,6元一颗,比它大,果,货已发出啦大哥,3.8是一年苗,而且真不是故意给您漏发的 赠送的美早苗也给您发过去了,什么价格,黄金蜜就可以,我给您补发过去,黄桃又怎么卖？,多少钱,发个链接给我,黑柿子又怎么样,哪种好,欢迎光临本店，量大价格从优，支持惠农网在线交易，看到您的留言我将马上回复，您也可以选择来电咨询哦！,好的大哥,石榴美早还有授粉树大哥,黄桃3元一颗大哥,没有就别勉强,黑柿子怎么卖,客气啦[大笑],您需要多少颗呢,黑石榴什么,30克,大哥 如果不需要的话您申请下退款哈我这边无法退款,俄罗斯8号和车厘子比较哪种更好些？,您拍图我看下大哥,发货途中温度高的原因大哥 不影响成活率的 后期有问题随时联系我哈,在吗,甜脆的不需要暖的,还没有"
正常,？？？
风险,"﻿老板你好，有个合作能找您谈下吗？如有意向的话加下ivucoho54426,在这个上面说不清楚，但我想一定不会让您失望的89"
正常,"欢迎光临本店，量大价格从优，支持惠农网在线交易，看到您的留言我将马上回复，您也可以选择来电咨询哦！,你好请问需要那种香橙站木"
风险,"在吗？,方便加微信详谈吗？,不好意思啊，我的微信有点问题,18935,258089,备注一下店名,加了吗？,加了吗？,加了没得呀？"
正常,"我们家还出售其它牧草,你好亲,高丹草种子买了吗,需要价格可以优惠哈,都是优质好种子,你好"
正常,"好的,老板我的什么时候发货呢,发货了,你好，朋友一定要退款是吗,发好点的,老板今天能发货吗？,明天可以发的,欢迎光临本店，量大价格从优，支持惠农网在线交易，看到您的留言我将马上回复，您也可以选择来电咨询哦！,也快了,明天会发货的，只是受到疫情影响，快递发货会慢些，请谅解！,现在买什么时候发货"
风险,宋老板你好，本场大量种植杨梅苗，欢迎你的采购，谢谢。
正常,"欢迎光临本店，量大价格从优，支持惠农网在线交易，看到您的留言我将马上回复，您也可以选择来电咨询哦！,现在没货"
风险,"你们哪里的呢，是你们自己过来摘吗？,2.8-3,我家有耙耙柑，需要吗？,上门装车，报个价,我是蒲江西来镇的。,136,0811,3699,现在你们可以给什么价？,我们已经卖了，4.1，现在价格还在涨。,不限量"
正常,"好,欢迎光临本店，量大价格从优，支持惠农网在线交易，看到您的留言我将马上回复，您也可以选择来电咨询哦！"
正常,"有菌种卖是吧,现在种什么时候可以出菇,你是哪里的,2块一斤,种木头的,广东的,要明年吗？,中温的,在木头上打眼的那种,是香菇吧？,你的是高温的吧,可以不包邮,一包二斤多点,是的,是的,是的,先试试,一包几斤？,欢迎光临本店，量大价格从优，支持惠农网在线交易，看到您的留言我将马上回复，您也可以选择来电咨询哦！,你需要多少,那种的，现在种明天后半年出菇,有些给叫成高温的,先拿几包试试"
正常,"现在顺丰的邮费起步价钱是18元，没有一包没有办法包邮,嗯,本公司专业辣椒杂交制种二十余年！主推高辣系列，艳椒单生贵族，高辣霸王，高辣单生大果，泰辣单生819，818，816，簇生高辣，越级天宇，川田千斤，满山红，韩国红五号，天闻二号，艳红系列，艳红大果，艳奇，娇艳，聚缘草莓椒，聚缘子弹头，袖珍椒子弹头，杭椒，螺丝椒，美人椒，港椒，芜湖早椒王，各种线椒，甜板椒系列，色素椒！金塔系列，千斤红，北京红，适合腌制，干制，打酱，走市场！品种齐全！欢迎各位新老客户亲临指导！,过几天吧,您好老板一包种子不包邮，,欢迎光临本店，量大价格从优，支持惠农网在线交易，看到您的留言我将马上回复，您也可以选择来电咨询哦！,你上面说的一包包邮,如果我上面说一包包邮的话就不需要修改了，现在所有辣椒品种都是3包包邮，您出15块钱邮费"
风险,"但是还在吗,好用吗,是广州的吗？,可以方便加个微信细聊吗？,这个软件不常上，加个微信方便聊"
正常,"请问你这是哪里,我看写的是松原,我想买种公羊,1只,我家里养的是寒羊,把你电话方便告诉我吗"
风险,"我们做的就是批发,老板哪里的,太远了,10000以上起批,我们都是专车专人配送,要么客户过来拉"
风险,"我在采购猪苗，您有现货吗？价格多少？,合适我过几天过来装,全是外三元吗？？？,中介,实际重量是多大开始出售,单次有多少货？,你要多少,对的,发四川可以吗？？？？,10公斤至20公斤级的每天有好多头？？？,1551111,是自己养殖场的还是中介？？？,3789,你们河北哪里？？？,石家庄,来时联系,哦！我们长期要，基本上是好大的"
正常,"你好亲,需要柱状梨树苗吗？"
正常,这是最低价了吗？
正常,"你好需要黑砖苹果树,苗吗"
风险,"您好，在吗,你这是有,黄杨卖吗？,我们老板准备进一批,价格如何,我做不了主,是我老板要买,？,什么,好,我去问问我老板"
正常,"你好,想要玉米种子青农11"
正常,"欢迎光临本店，量大价格从优，支持惠农网在线交易，看到您的留言我将马上回复，您也可以选择来电咨询哦！,你好    还有姜种吗？"
正常,"亲你好可以做代理吗,我来做代理帮你卖东西,云南玉溪,哦总共有多少个机型`,每个机型和价格配图我了解了解,好的"
正常,"有,欢迎光临本店，量大价格从优，支持惠农网在线交易，看到您的留言我将马上回复，您也可以选择来电咨询哦！,什么价格,28平均。,还有猪吗"
风险,"1718745+3886,这是我们公司财务的微信,没在我手上我没办法加你"
正常,"在么,你好，我刚打了你的电话，但是你没接，期待你给我回复。,刚行开了"
正常,"要了联糸,好"
正常,12公分和15公分
风险,"1830280,9997,wei xing,您已跟对方成功接通电话，赶紧“关注”他，成为生意伙伴吧！,您已跟对方成功接通电话，赶紧“关注”他，成为生意伙伴吧！,你好,是需要高杆茶花吗"
正常,"欢迎光临本店，量大价格从优，支持惠农网在线交易，看到您的留言我将马上回复，您也可以选择来电咨询哦！,您已跟对方成功接通电话，赶紧“关注”他，成为生意伙伴吧！,你是北流的吧"
风险,"大量订购多少钱,我爸妈想买来摆小区里卖,你加我爸卫:heart:️给他聊吧，我在帮我选购别的去,具体多少我也不清楚,手机号不可以发,1528759733
6微,你加我爸吧,我在帮选选别的了"
正常,"老板，你发货地在哪？,老板，你发货地在哪？"
正常,"欢迎光临本店，量大价格从优，支持惠农网在线交易，看到您的留言我将马上回复，您也可以选择来电咨询哦！,是的"
正常,"没有,现在你还有什么水果,快递,净重8.5,橙子苹果猕猴桃等,100斤怎么走物流还是快递,青黄色现在果子不太好,后天出去,要仓库那边去拍,很小吗？,有实物图吗,价格,哦  好吧,中等,包邮吗？,一块一斤的苹果是中果，不包邮，100斤起，100斤运费130元，带箱9.5-10斤，净重8.5斤发10件。（青海、西藏、新疆、黑龙江、吉林、辽宁、湖北 以上地区不发）,现在只有整件,我们这边2天放一次出去,价格能便宜点吗,嗯，不建议拍,我要皇帝柑,一件多重,贵妃芒呢,明天吧,哦,成色怎么样,有实物图吗,你那里还有多少件  现在是橘黄色还是青色的果"
正常,"你好,您已跟对方成功接通电话，赶紧“关注”他，成为生意伙伴吧！,我想要果苗,您好！,您是想咨询布福娜苗吗？,有果苗吗"
风险,"老板你好，有意买产品
架威详谈151
9199
4794



"
正常,"欢迎光临本店，量大价格从优，支持惠农网在线交易，看到您的留言我将马上回复，您也可以选择来电咨询哦！,你好,在的"
正常,"泸县哪里自提,鱼苗有好大,欢迎光临本店，量大价格从优，支持惠农网在线交易，看到您的留言我将马上回复，您也可以选择来电咨询哦！"
风险,"在吗,你好,可以邮寄了吗,我需要5000只,有吗,安徽的,＋个可以吗,好联系,好的，麻烦你加下,加了吗,好的,135345
59615是这个吧,对的,是微信号，等会，我老公的,好的,我记下"
风险,"你好,疫情结束想跟你合作进一批货我们老板,您方便加个v 吗,是的,可以加我们老板v 商量吗，但是发具体地址给你,我负责联系,具体还是你加我们老板细聊,134230,46873,好的，谢谢,加好了吗我好联系,加好了吗,我联系老板"
正常,您好，感谢关注雅趣普洱[惊喜]
正常,"你好欢迎进入百益苗木有限公司
选购优质嫁接果树苗
品种齐全量大优惠
有什么需要随时联系我"
正常,"嫁接过的吗？,我要不嫁接的,有种子吗？,我要便宜点的"
正常,"是的,怎么联系你,欢迎光临本店，量大价格从优，支持惠农网在线交易，看到您的留言我将马上回复，您也可以选择来电咨询哦！,你好,有三黄鸡吗"
风险,"你好,现在黄牛600/800斤左右的牛多少钱一斤,活的,你们是自己的农场吗,育肥的,散养的呢？,你的微信是多少？我加你微信好不好？"
风险,"包邮吗？购买后多久发货？,在哪里,那可以先加微信,你加我吧,加了说一下 我好备注,嗯,好的"
正常,"哦,18,欢迎光临本店，量大价格从优，支持惠农网在线交易，看到您的留言我将马上回复，您也可以选择来电咨询哦！,什么价,方便留一个电话不"
风险,"老板家的产品方便加个微信了解下吗
聊好了可在这里下单
我这加客户过多被限制麻烦您+我了
167~2513~2569,要草鱼鱼苗 可以的话 加我详谈,对  我这消息回不过来 麻烦你了 加下"
正常,"你那里发货到郑州需要几天,你那里要多少便宜,我们几个商量一下,他们几个说有点贵，我自己要的也要不了太多,老板要多少？发到哪里,你们看多少钱合适,希望给个最低,一般2天左右到,算好了，20箱,明白了,你哪里是批发吧,我在郑州，你那里最低多少钱,你要多少数量,请问保质期多少天，,包邮吗？购买后多久发货？,一箱里边是不是全是毛蛋,他们说2毛一枚，你也不确定一件里边有多少毛蛋吧，,发的大货车,最低批发价多少？,老板，运费怎么算？,我要的多了怕坏了，现在疫情还没过去，,在不,广州白云区这边的,运费是谁的,我给他们说下,4毛一粒,是的,嗯嗯，不会断货吧,嗯嗯，,要放进冷藏住。肯定都是毛蛋,要多少数量,我们几个人呢,现在货很少，要的尽快,你好，张老板。毛蛋现在还有需要吗？,你看能要多少数量，好给你报价,这个不一定，,一件360枚，算3毛给你,包邮吗"
正常,"欢迎光临本店，量大价格从优，支持惠农网在线交易，看到您的留言我将马上回复，您也可以选择来电咨询哦！,今天西红柿多少钱，五千斤"
风险,"你好,大概150十,我去问一下我老板,我老板没回我信息  你看你能先加一下我老板微信吗？  因为我这边还要去搞别的,你加了备注柿子苗"
风险,"你好,我们要大量采购,135336,44491,你加我们经理谈价钱吧,加了跟我说一下，我去通知他"
正常,"你哪里陈老板,最低批发价多少？,多少钱一头,多少钱一斤,不按斤的,按头的,一头有多重,猪仔,你需要多大的？"
风险,"售后服务有哪些呢？例如运输货损赔偿，一贵就赔等等。,这个甲鱼需要为什么,喂,可以佳威？,那个不好意思, 昨天没看,您方便佳我一下？"
正常,你好！搞50吨长糯米有吗？现在岀厂价什么价格吗？
正常,"你好，我这边可以发货了。请确认一下你的订单，联系车,你好"
风险,"你好！是批发商对吗？,想拿批货，你是负责人人跟你谈吗？,你佳我老板v你们直接谈，我是负责人找货源的,15903164,952,佳了讲一下，谢谢,佳了吗？好通过,OK"
风险,"欢迎光临本店，量大价格从优，支持惠农网在线交易，看到您的留言我将马上回复，您也可以选择来电咨询哦！,你好,2711555222,微"
风险,"欢迎光临本店，量大价格从优，支持惠农网在线交易，看到您的留言我将马上回复，您也可以选择来电咨询哦！,1500562,6662,下半年高峰期来临，大家都很忙，有事打电话，打电话，打电话，"
正常,有需要的吗
风险,"在？,你这个大概什么时候发货,那一百多颗能不能做到,那具体数目能不能＋v,我v方便一点:smiley:"
