风险,"你好老板！我想从你这大量批发,如果还不能发货或者担心托运问题我商量下,我们谈谈价格加我薇信吧，诚信长期合作,1847,5619,139,我手机要没电了，麻烦你加一下,你加我微信聊 我要大量"
风险,"您好，我是周围城市的批发商，您家产品很不错，我想和您合作采购大量
谈好了可以在这里拍商品，您伽我微信
167~
1067~
6480
,桂林 加我详谈"
正常,"老板您好，请问找什么品种的果苗呢？,不需要的,谢谢啦"
风险,"你好,你好
我想从你订货，加我老板微信详谈把1591124,2317,加好了告诉我一下，我给备注"
正常,"这是四季桂花吗？,是的,欢迎光临本店，量大价格从优，支持惠农网在线交易，看到您的留言我将马上回复，您也可以选择来电咨询哦！"
风险,"你好，你的产品我有兴趣,方便家个联系方式吗?,商量好我们用惠农网交易,我的是,171,0278,2600"
正常,"在吗？,欢迎光临本店，量大价格从优，支持惠农网在线交易，看到您的留言我将马上回复，您也可以选择来电咨询哦！"
风险,"你肯定没见过我们乳山牡蛎,收到,你可以上网查一下,明白了,图片就是我家的货，全部都是清洗干净的。,不是快递的事哥，一天量达不到，我不可能为了你几百斤而出货，我的工时费，各种费用不合适。,小豆年前价2.8一斤，现在还没出，具体价格还定不下来。我家是鲜活的。我家不加工冻货，冻货都是残次品，正儿八经的餐厅不会用冻货的。,到时候发样板可以给我发几个3两多看哈，这样的价格多少,不是水蚝吧,好,好的,你的量达到了，价格肯定会低,重庆很多客户，乳山也有很多业务员在重庆，友情提示您可以试试乳山牡蛎，想用您可以告诉我，我可以给您发样品,1386909,可以发货了吗？,5233,1386909,地地道道乳山本地牡蛎，海水养殖。,还没有啊哥，还不知道要等什么时候呢，着急也没用啊，物流不通。放心物流通了我会告诉你的,哦，弄错了,5233,随时联系我就行,1573028,"
正常,"你好，我刚打了你的电话，但是你没接，期待你给我回复。,现在发不了货老板疫情严重"
正常,"你好！,你需要干湿分离机"
正常,您好，可以发货的，拍下后48小时内发货
正常,"你好，欢迎光临山东沂蒙靖彩家庭农场！本农场所有苗木都是现挖现卖，品种齐全，批发零售！山东沂蒙靖彩家庭农场将竭诚为您服务！,需要板栗苗吗"
风险,"165,7382,1740,一会我回去了，我同意加你，手机不在身上"
风险,"你好老板，你家货物不错，我有意大量购买
谈好了可以在这里买

茄的时候备注下你卖什么的。.

这个是我的薇

180
62
46
09
79,山木香  老板加我详谈"
正常,赖先生您好，欢迎游览我的页面，在了解青蛙养殖吗？
风险,"你好老板，你家货物不错，能大量合作嘛
茄我维信谈谈怎么合作,物流价格等
1513
2475
753,昂？不是啊 老板 ,这里我不常看  所以让你加"
正常,"我也是农民，专做绿色食品的,其实食品类的东西，特别是农产品认证类的证书之类的都不那么标准,相对而言,我们种植地都是沙漠改造的,现在百分百有机的产品在全国范围内基本没有,噢,我们这是大田种植，免不了,噢！,反正我都没用过，支持任何人检测,我每年能不用的药就不用，肥料投入也用农家肥代替好多,我养有牛羊猪鸡鸭等等，种有蔬菜瓜果等等，比较杂（不专业），就因为外面的食品质量让我不敢恭维，所以尽可能的自种自吃为主,嗯，能请你谈谈你对你的产地红枣有啥特色吗？,像果子这种东西，无论干果还是水果，都有很多药剂,建议现在别下单,有时间就告诉我一声,是啊！,我自己的亲戚朋友都是吃的我的枣[大笑],噢！,请问你的红枣有经过绿色食品质量认证的吗？,没有快递,我们这边可以快递红枣了，可以下单了[大笑],你好,嗯,好呀,哦,由于我们这边是兵"
正常,"这个是多大马力,什么价格,哦,有二手的么,湖北孝感大悟的,嗯"
正常,"货运费太高,我给你发那个地址运费啥价,能发货不现在时期,河南商丘市睢县,火车,好的,你这是烘干厂是不,里外都一样,好的,都有几等玉米,今天问了下配货的运费210，有需要请留言。,不是,刚才又问别的配货站180也有装的,火车发不了，发到哪,你好,欢迎光临本店，量大价格从优，支持惠农网在线交易，看到您的留言我将马上回复，您也可以选择来电咨询哦！,我们发的都是货运,全部优质,你好,我的问问，我们也是在配货站找车，现在也不好找。,货车"
正常,"大力马网,用拖网,我在采购水产捕捞设备，您有现货吗？价格多少？"
风险,"你好老板，你产品不错我想大量进，
惠农网下单可以？
加个威信联系吧
187
8751
9870,你好老板，你产品不错我想大量进，
惠农网下单可以？
加个威信联系吧
187
8751
9870"
风险,"在吗,我需要300箱，你那有吗,好，加我微信，发货通知我，我需要安排时间,加了吗,你加我"
风险,"在吗,我们老板要定制一批树苗,把数据报给你"
正常,"后天可以发货,可以"
正常,"您收货地址在哪呢,我们是做批发的  省外要2000只起发的,要什么品种呢,但是鸡苗没有一贵就赔，因为鸡苗行情波动非常大，经常一天一个价，现在涨价也比较厉害,欢迎光临本店，量大价格从优，支持惠农网在线交易，看到您的留言我将马上回复，您也可以选择来电咨询哦！,是的,200只发不了哦,不好意思啊,河北哪里啊？,一次要多少只,您好，运输死亡我们这边全部负责"
风险,"欢迎光临本店，量大价格从优，支持惠农网在线交易，看到您的留言我将马上回复，您也可以选择来电咨询哦！,你好，可以留一个联系方式，到时候我们这里可以联系你的负责人，或者你可以打这个电话微信同号1515,8310,398,好的，收到,可以了,你好，我们想买这个杨梅苗
方便和我们总负责人联系吗？具体的是她说了算,欧欧,18078259,446,加一下告诉我我去跟她说,加了嘛，我好登记一下"
正常,"都按一样的价格,香酥脆枣一箱多少？,香酥脆枣有两个规格:每箱20包，每包250克
                                      每箱30包，每包160克
两款价格一样,你好，香酥脆枣整箱95元每箱，20包✘250克,咱们是厂家吗？,您好，我们是厂家直销，平台回复不及时，您可以通过平台致电我们,什么价格,不带芝麻的，多少钱一箱"
风险,"包邮吗？购买后多久发货？,大量要 方便微信细说吗[亲],包邮吗？购买后多久发货？,您加我吧,加了给我讲一下我给您备注,好"
风险,"你好老板,售后服务有哪些呢？例如运输货损赔偿，一贵就赔等等。,嗯,[可爱],大概500株,Ok,加个v？,哎？我怎频繁了,我今天没有加人,算了算了，你加我可以吗,马上,1511387,4589,加了告诉我，我去同意"
风险,"欢迎光临本店，量大价格从优，支持惠农网在线交易，看到您的留言我将马上回复，您也可以选择来电咨询哦！,都有,老板哪里的？,1500562,6662,需要可以电话问问"
正常,"额，太多了,三级果二级果什么区别,包邮吗？购买后多久发货？,什么时候可以发货,现在可以发货吗,现在物流可以发货了吗,欢迎光临本店，量大价格从优，支持惠农网在线交易，看到您的留言我将马上回复，您也可以选择来电咨询哦！,20件起发,20件起发，1200斤,一级二级三级有啥区别,老板，是现货吗？"
风险,"在吗,想买点药呢不知道买那种,你对这个懂吗？,果树啊,有20来亩地把,你加我呗..,你那个我咋加不上,15   803     1  ,5  876 3,加了？,嗯"
风险,"欢迎光临本店，量大价格从优，支持惠农网在线交易，看到您的留言我将马上回复，您也可以选择来电咨询哦！,老板问一下这个需要加热吗？,依个人口味，加热后会影响口感。"
正常,你好，线椒苗、二荆条辣椒苗、茄子苗，需要请联系。
风险,"6443,要多少,欢迎光临本店，量大价格从优，支持惠农网在线交易，看到您的留言我将马上回复，您也可以选择来电咨询哦！,包邮吗？购买后多久发货？,137,5213"
风险,"你好！老板，我公司主营：高科技益生菌发酵腐熟纯鸡粪、纯羊粪、生物鸡粪、生物羊粪、活性菌发酵鸡粪、腐植酸发酵鸡粪、生物有机肥、生物有机菌肥、生态有机肥、专业调理土地盐碱的、（柱状）肥的高活性有机肥、冲施肥、大量元素水溶肥、氨基酸水溶肥等等，可提供有机肥原料、糠渣、有机肥半成品、罐装、代加工。全国诚招代理商 经销商 种植基地合作 详询 1
五128005072 欢迎各界朋友来厂实地考察参观  "
正常,"你好,打电话没人接的？,你是南宁的吗？门店的详细地址呢？"
正常,"现货两吨,我在采购白术种子，您有现货吗？价格多少？"
风险,"老板你好，我是一名批发商，这是我危*信,我量大长期合作，
谈好了可以在这里买

1653~984~24~71

伽的时候备注下你卖什么的。
,需要 加我详谈,方正,加我说吧"
正常,"您可以选择退款，望理解,你好,现在疫情非常时期，您要的货发不出去，敬请担待"
正常,"有人吗？,都买完了  下次再合作吧,老板，有货吗？,有,欢迎光临本店，量大价格从优，支持惠农网在线交易，看到您的留言我将马上回复，您也可以选择来电咨询哦！,你好，我刚打了你的电话，但是你没接，期待你给我回复。,您已跟对方成功接通电话，赶紧“关注”他，成为生意伙伴吧！"
风险,"1576666+9471,最低批发价多少？,老板，运费怎么算？"
正常,你好，你需要欣赏牡丹花
正常,你好，这鸽子一只重两斤多?
正常,"欢迎光临本店，量大价格从优，支持惠农网在线交易，看到您的留言我将马上回复，您也可以选择来电咨询哦！,芒果怎么批发代理"
正常,"包邮.偏远地区除外,老板，运费怎么算？"
正常,"运费多少钱,带土发货40元,带土发货40元,运费多少钱,20颗,亲，要多少数量呢？,裸根快递12"
正常,"需要可以直接下单,包邮吗？购买后多久发货？,您好，wwtwuw需要jldlew可以wzgyigzhijzhi jgzhi lidzhi jiewzhi jie ygzhi jie yidzhi jie xizhi jie yiazhi jie"
风险,"欢迎光临本店，量大价格从优，支持惠农网在线交易，看到您的留言我将马上回复，您也可以选择来电咨询哦！,地址是哪里啊？电话,185537,31794"
正常,"你好，我刚打了你的电话，但是你没接，期待你给我回复。,哈喽，您好，老板,您是养猪的吗？"
正常,"哦哦，,欢迎光临本店，量大价格从优，支持惠农网在线交易，看到您的留言我将马上回复，您也可以选择来电咨询哦！,你好，我刚打了你的电话，但是你没接，期待你给我回复。,你们这些木材光挖土茯苓，累死累活赚，赚不到钱,大表哥，我认得你，我们都是一样的，我也是卖的,我好像是点错了，不好意思哈,今年的土茯苓种子好卖呀,您还要收购土茯苓吗,四川那么大，哪里都是山上？只要有山都有种子，这个土茯苓种子,好的,关键是藤都死了，上面好像没有种子,现在都是干的吧,要想发点小财，就在这一个月,都掉光了,多跑几座山，土茯苓种子在网络里面拍卖，大把老板要,哦，原来如此，我明白了，那是我以前踩个小土茯苓做育苗用的,指点你一下，讲缘分认识你，现在土茯苓价钱不好，我提个建议，你去摘土茯苓种子卖价钱好,现在还没货哦，大哥,我看你发布了收"
风险,"1585375,6543"
风险,"在吗,我要批发 要的数量比较多,质量保证吗,能加微信细聊吗,171,851,545,65,具体的价格谈一下,包邮吗？购买后多久发货？,哥,就能加微信吗"
正常,"你好,洋市！你有车送吗,胡家坊,发你电话来"
正常,您好，可以发货的，拍下后72小时内发货
正常,"我在采购柑桔苗，您有现货吗？价格多少？,裸苗，2.8元一颗"
风险,"欢迎光临本店，量大价格从优，支持惠农网在线交易，看到您的留言我将马上回复，您也可以选择来电咨询哦！,1558413,7775,加个wx 方便联系
1558413 
7775"
正常,"谢谢,好的,您好老板，我们是专业农资批发商，供应各大公司正品杀菌剂，杀虫剂，调节剂，冲施肥，叶面肥，生物菌肥，免费包邮，量大优惠，敬请关注一下，以便不时之需，谢谢！"
正常,"最低批发价多少？,老板，运费怎么算？,二万斤"
风险,1805441+0196
风险,"你好在吗？,我果园里需要种,你这有多少呢？,我要的比较多,这个你方便加一下我vx嘛？,182870,26255,vx上聊更方便 好了直接下单你看可以吗？,种的好了我完了还会买的 ,你先加我吧,好的,稍等一下,我这会有点忙"
风险,"老板家的产品方便加个微信了解下吗
聊好了可在这里下单
我是同个市批发商方便的话也可以实地去看
1597~3480~513
客户比较多，家的时候麻烦备注下,你好老板 可以的话 加我详谈 我这客户很多 加不了"
正常,"在,5斤3.5到4.2的运费自理多少钱呐？,大概,哦哦 好吧"
正常,"老板您好，请问需要什么鱼苗呢？,在的"
风险,"老板你好，感觉你这个产品挺不错的,方便加个联系方式么,商量好我们用惠农网交易,加我薇吧,171,8977,4414,老板你好，感觉你这个产品挺不错的,方便加个联系方式么,商量好我们用惠农网交易,加我薇吧,171,8977,4414"
风险,"欢迎光临本店，量大价格从优，支持惠农网在线交易，看到您的留言我将马上回复，您也可以选择来电咨询哦！,5克左右"
风险,"欢迎光临本店，量大价格从优，支持惠农网在线交易，看到您的留言我将马上回复，您也可以选择来电咨询哦！,老板哪里的,1500562,6662,有需要联系,1500562,6662,可以电话联系"
风险,"你好，我是一名批发商，这是我威*信,我量大长期合作，
谈好了可以在这里拍商品

1653···9842····664

伽的时候备注下你卖什么的。.,你好，我是一名批发商，这是我威*信,我量大长期合作，
谈好了可以在这里拍商品

1653···9842····664

伽的时候备注下你卖什么的。.,我需要"
风险,"你好老板，我看你的产品不错
可以+威信不？
没问题用惠农
我的
13945
276
894
诚信合作！,加我  详谈吧啊我这客户很多 回不了"
风险,"你好,嗯,我想咨询一下,可以加个微信吗"
风险,"欢迎光临本店，量大价格从优，支持惠农网在线交易，看到您的留言我将马上回复，您也可以选择来电咨询哦！,好,155,3709,5020"
风险,"137
861
358
21
你好，我是你附近市的批发商，这是我的薇，有意批发
聊好了在这里拍,不信算了"
风险,"你好在吗,是批发商吗,你是老板吧[可爱],我们这样想订购一些"
风险,"老板你好，我是一家农副产品的采购商，感觉你的产品挺不错的，想批发一些试试，如果消息没有及时回复，你+我的微信我们语音聊，麻烦你了！171/8977/4982,加我微信详聊"
风险,"你好老板|你家货物不错|我能大量进持续合作嘛
你先茄我微~信谈谈怎么合作,物流价格等
15 3
08 25
13 98
加的时候麻烦你备注下,你好老板，可以的话 加我微信详谈吧，不方便的话那打扰了，我这客户多回消息不方便，诚信合作"
正常,"付款单给您发过去了  点开付款就好,好的:ok_hand:，老板,要直接给我寄到我发得地址，我们这里是农村，,那地址发给你吗,可以的老板,山东的亲,点开付款填上地址就好  明天给您挖苗发货,包邮的,老板5快可以不,教练我怎么栽可以不，我们原来没栽过,软籽甜石榴,两年苗7.2一颗  给我7元,看一下根系,您好老板,给您6.5一颗吧  试种可以长期合作,好的老板  明天给您挖苗发货,那给我十棵，,关键是我们这边现在还没人栽,两年苗需要种下去几年才会结果,点开付款单填上地址付款就好,我需要10棵，多少一棵,不可以的亲  ,嗯好的  就是按照您的地址发货,甜石榴还是酸石榴,可以吗老板  可以的话给您改价,我是怕到货后栽不活，原来买车厘子就是给我寄快死的苗[流泪],包成活包结果包品种,便宜点，要是我适种成功以后还要买的多[大笑],品种来南方会适应？,给您发付款单  给您改价,"
风险,"商家你好，我现在没有打算定制你们的产品，我没事就是先了解一下,还是说是电商？,138,5938,5438,加我,你是什么平台的？"
正常,"老板，运费怎么算？,包邮"
正常,您好，我公司专业生产迷宫式滴灌带，河北保定
正常,"不要，谢谢,你好,好的，,需要金边瑞香吗？,有需要随时欢迎选购"
正常,"老板，运费怎么算？,批发价和市场挂钩,自费,现在价格长得凶，都7块几了,最低批发价多少？"
正常,不需要
风险,"你好,想买你家的这个,可以加一下wx，跟你聊,180983,91477,加了吗？[可爱],加了可以说一下吗[可爱]"
正常,亲，可以正常发了
风险,"你是,有电话可以咨询吗,我这边需要大量,好的,你是供应商还是自己家的产品？,好的"
正常,"噢,怎么还不发货？,还发不了,知道了,现在发不了，需要等等,估计要到24号以后"
正常,"陈总你好,需要多少粉葛种苗啊"
正常,我在采购玉米粒，您有现货吗？价格多少？
正常,"在,在,100斤怎么算,火龙果,一个几斤,大果,那么小,小的多重,哪个快递"
正常,"欢迎光临本店，量大价格从优，支持惠农网在线交易，看到您的留言我将马上回复，您也可以选择来电咨询哦！,多少钱,你好在吗,您需要多少亩，用来做什么"
正常,"您好，朋友！
需要可以下单，24小时内发货。
量大从优，请咨询客服。
祝您生意兴隆，生活愉快。"
风险,"老板你好，我对你家产品有意，并且大量批发长期采购
希望您可以先迦下我威~~信，以后好联系我
167~~
1067~~
6501,老板你好，我对你家产品有意，并且大量批发长期采购
希望您可以先迦下我威~~信，以后好联系我
167~~
1067~~
6501,你可以先加个我微信，谈完可以再这里交易的
167~1067~6501
,老板你好，原来那个号客户加的太多频繁了，您可以先加我这个
1671~0676~486"
风险,"欢迎光临本店，量大价格从优，支持惠农网在线交易，看到您的留言我将马上回复，您也可以选择来电咨询哦！,在冷库冻着的,你需要那一种,一般都是三四天左右,要是遇到大雪什么的  可能就慢点了,你可以先要上几件样品  先看看货的"
正常,"什么时候可以发货？,包邮吗？购买后多久发货？"
正常,"多重？,欢迎光临本店，量大价格从优，支持惠农网在线交易，看到您的留言我将马上回复，您也可以选择来电咨询哦！"
正常,"你好，我刚打了你的电话，但是你没接，期待你给我回复。,欢迎光临本店，量大价格从优，支持惠农网在线交易，看到您的留言我将马上回复，您也可以选择来电咨询哦！,您已跟对方成功接通电话，赶紧“关注”他，成为生意伙伴吧！,有多少货？,你好，有40多吨吧,欢迎光临本店，量大价格从优，支持惠农网在线交易，看到您的留言我将马上回复，您也可以选择来电咨询哦！"
正常,"欢迎光临本店，量大价格从优，支持惠农网在线交易，看到您的留言我将马上回复，您也可以选择来电咨询哦！,现货，19年烘干玉米，水份15以内，容重720以上，霉变1以内，质量好，运到站台1820元一吨，从站台到您那里的车皮运费，由您出，汽运随行。"
风险,"你好,嗯嗯,亲，我想长期在你这拿货，你看能不能优惠点,亲，我老公现在不在，等他来了我问一下这个价格他能不能接受,你先加一下我，下午我回复你,137,29308273,加了吗？,？？？"
正常,"欢迎光临本店，量大价格从优，支持惠农网在线交易，看到您的留言我将马上回复，您也可以选择来电咨询哦！,在吗,现在下什么时候发货"
正常,"欢迎光临本店，量大价格从优，支持惠农网在线交易，看到您的留言我将马上回复，您也可以选择来电咨询哦！,求购红宝石海棠苗4000棵，高20公分处测量，2公分粗度，独杆，裸根，报最低上车价。。。。"
正常,你好，有大量优质八角树苗供应
风险,"在,在,买多可以优惠吗,好的,可以加微信说梦,我好友限制了 要你加我,我需要200斤,不方便,接电话,可以在微信说,15820,236910,加了吗,加过了吗 我没看见"
正常,"欢迎光临本店，量大价格从优，支持惠农网在线交易，看到您的留言我将马上回复，您也可以选择来电咨询哦！,你好，外地能不能送货"
正常,9.9元一箱橙子有几斤 包邮吗
正常,"是什么时间产品,过几天,欢迎光临本店，量大价格从优，支持惠农网在线交易，看到您的留言我将马上回复，您也可以选择来电咨询哦！,你这个石见穿药材是否正品"
正常,需要重楼吗
正常,"好,您需要什么样的人参？我给您讲解一下啊,好,您好需要点什么呢,你好"
风险,"欢迎光临本店，量大价格从优，支持惠农网在线交易，看到您的留言我将马上回复，您也可以选择来电咨询哦！,你好,可能贵哦,出省了,我问问"
风险,"您好在吗,我们店想进货，你们什么时候可以发货,麻烦您加下我们老板可以吗，每次拿货都是他联系人的,1809,7431224,分开的,名是金果果,加的时候记得备注下点名，好联系,店名,加了吗,加了的话说下老板有点忙，我让老板去同意"
正常,"欢迎光临本店，量大价格从优，支持惠农网在线交易，看到您的留言我将马上回复，您也可以选择来电咨询哦！,每包有多少斤,10斤"
风险,"您好，我是周围城市的批发商，您家产品很不错，我想和您合作采购大量
谈好了可以在这里拍商品，您伽我微信
167~
1067~
6480
,您好，我是周围城市的批发商，您家产品很不错，我想和您合作采购大量
谈好了可以在这里拍商品，您伽我微信
167~
1067~
6480
,洋葱,加我详谈"
正常,"包邮吗？购买后多久发货？,沙糖桔？,你好，沙糖桔现在能进去收果吗？,只能帮你发货,欢迎光临本店，量大价格从优，支持惠农网在线交易，看到您的留言我将马上回复，您也可以选择来电咨询哦！"
正常,"项鸡有三斤吗,想团购项鸡，阉鸡。,有货吗,自提可以,养肥才有,鸡有点瘦,项鸡50只左右，阉鸡30只左右,我以为在南宁,要养个把星期才能吃,在哪里,欢迎光临本店，量大价格从优，支持惠农网在线交易，看到您的留言我将马上回复，您也可以选择来电咨询哦！,在吗亲"
正常,家们哈，我也姓钟，也种了200亩柑橘，以后多多请教哈
风险,"老板你好,有点事请教你一下,这上面说得不太清,这是我薇yy⑨⑤②Ο⑧⑧②谢谢了109"
风险,"在吗,现在能发货不,很郑州,河南郑州,这个我还不是很清楚,多得话有没有优惠呢？,[可怜],几千株吧,那可以,你加我们老板的微信你们聊一下数量和优惠吧,老板？,151,74247689,您加了嘛，加完了告知下，这边让老板和您讲,好的,我去通知,没有啊,我就是找找货源，你们聊价格就行了，我微信通知他了等他同意了你们聊一下,不客气"
正常,"您好，有什么需要？,这里付款就行,对的,下单就行,地址对的吧"
风险,"老板家我详谈，我是邻市的批发商
182
457
364
97
客户比较多，家的时候麻烦备注一下卖什么的
谈好了，在这里或者线下交易都可以,你好加我了吗"
正常,"您好！,需要丝瓜苗吗？"
正常,"询问一下？,有3公分直经的吗？啥价？,是最新品种不？,大概1千颗左右,这么贵？,二公分左右的多少钱？,山东苗吗？"
正常,您好老板 要蕨菜吗
正常,你好老板需要杨梅苗吗？
风险,"电联1866957/8188,欢迎光临本店，量大价格从优，支持惠农网在线交易，看到您的留言我将马上回复，您也可以选择来电咨询哦！"
正常,你好！我家原产地的竹筷感兴趣吗
风险,"新鲜的还是干的,野生还是人工的,有的,加微信,hzl150891,666,1508727,1891"
正常,"欢迎光临本店，量大价格从优，支持惠农网在线交易，看到您的留言我将马上回复，您也可以选择来电咨询哦！,发到哪里亲,在吗？,生产日期是什么时候,河北,19年4月份,什么时候可以发货？,小件韵达 大件德邦,在的,包邮,今天发出,发什么快递？,什么时候发货？,满35包邮吗？,玉米小麦可以用吗？"
正常,"大量批发的。,只发海鲜专线物流车。,什么时候发货什么怏递呢？,不发快递的"
风险,"老板你好,我需要大量苗,你看方便加微详谈吗"
